"<b> Teams may encounter the need for ""technical"" user stories. Who decides the priority of these?</b><br><ul><li>the Product Owner with help from Operations</li><li>the Tech Lead with help from the Product Owner</li><li>the Product Owner with help from the Tech Lead</li><li>the Tech Lead with help from Operations</li></ul>",the Product Owner with help from the Tech Lead
<b> What is the Scrum Master's role during the daily stand-up?</b><br><ul><li>Congratulate the team on their great work.</li><li>Stand outside the circle of developers and listen for impediments.</li><li>The Scrum Master should not attend—this meeting is for developers only.</li><li>Ask each developer what they did since the last daily standup.</li></ul>,Stand outside the circle of developers and listen for impediments.
<b> Which factor should not be considered during Sprint Planning?</b><br><ul><li>the team's velocity</li><li>the number of stories in the product backlog</li><li>the stories that are ready</li><li>the team's capacity</li></ul>,the number of stories in the product backlog
"<b> A team member has been showing signs of great personal distress: crying at work, snapping at colleagues, having heated phone conversations. As Team Facilitator, what should you do?</b><br><ul><li>Give the team member space and time to deal with their personal issues.</li><li>Tell the others on the team that their teammate needs some emotional support.</li><li>Notify the team member's manager of your observations and ask the manager for help.</li><li>Ask the team member if they would like to talk about what might be going on with them personally.</li></ul>",Notify the team member's manager of your observations and ask the manager for help.
"<b> Which statement describes the flow of work in the Scaled Agile Framework?</b><br><ul><li>It is a ""push"" system.</li><li>It is ""push"" at the top and ""pull"" at the bottom.</li><li>It is a ""pull"" system.</li><li>It is neither ""push"" nor ""pull.""</li></ul>","It is neither ""push"" nor ""pull."""
"<b> What is the Product Owner's role in deciding the priority of work in the sprint backlog?</b><br><ul><li>None—the Scrum Master should prioritize the work in the sprint backlog.</li><li>The PO should prioritize the items in the sprint backlog.</li><li>The developers prioritize work unless they cannot complete it, in which case the PO should prioritize the remaining work.</li><li>None—the developers should prioritize the work in the sprint backlog.</li></ul>",None—the developers should prioritize the work in the sprint backlog.
"<b> The Scaled Agile Framework advocates that, if you measure only one thing, what should you measure?</b><br><ul><li>quality</li><li>predictability of delivery</li><li>cost of delay</li><li>return on investment</li></ul>",cost of delay
<b> Why should you apply Weighted Shortest Job First?</b><br><ul><li>to maximize the return on investment</li><li>to determine the economic sequencing of the backlog</li><li>to visualize queue length</li><li>to fulfill a commitment to quality</li></ul>,"to determine the economic sequencing of the backlog<br><br>[Source](https://www.scaledagileframework.com/wsjf/) `Weighted Shortest Job First (WSJF) is a prioritization model used to sequence jobs (eg., Features, Capabilities, and Epics) to produce the maximum economic benefit. In a flow-based system, priorities are updated continuously to provide the best economic outcomes. Job sequencing, rather than individual job return on investment, produces the best result. To that end, WSJF is used to prioritize backlogs by calculating the relative CoD and job size (a proxy for the duration).`<br>"
<b> You have classified the features in your backlog according to risk and value. Which features should the development team work on first?</b><br><ul><li>low-value and high-risk</li><li>high-value and high-risk</li><li>high-value and low-risk</li><li>low-value and low-risk</li></ul>,"high-value and high-risk<br><br>[Source](https://agilescrumguide.com/blog/files/tag-product-backlog---business-value-and-risk.html) `It is suggested that high business value, high-risk items are worked on first. While that may seem counterintuitive, the earlier this work is done, the sooner the team will move to mitigate the issues and unknowns—leading to a higher quality product. If there's a failure, it will occur early and relatively inexpensively.`<br>"
"<b> In the Scaled Agile Framework, what is the role of Enablers?</b><br><ul><li>They help extend the Architectural Runway.</li><li>They connect vision to mission so the organization can be successful.</li><li>They support team building.</li><li>They remove the impediments to quality.</li></ul>",They help extend the Architectural Runway.
<b> Which outcome is not expected of a Sprint Review?</b><br><ul><li>The team demonstrates its completed work.</li><li>The team reflects on how to improve its performance.</li><li>Items in the backlog may be reprioritized.</li><li>Stakeholders give feedback about the work completed.</li></ul>,The team reflects on how to improve its performance.
<b> What is not a technique used for splitting user stories?</b><br><ul><li>split by line-of-business</li><li>split compound user stories</li><li>split by alternative paths</li><li>split by interface</li></ul>,split compound user stories
<b> Who decides what the team will work on?</b><br><ul><li>the Scrum Master</li><li>a self-organizing team</li><li>the Product Owner</li><li>the Product Manager</li></ul>,a self-organizing team
<b> Which choice is not a Scrum value?</b><br><ul><li>focus</li><li>integrity</li><li>courage</li><li>commitment</li></ul>,integrity
<b> What should happen if the Product Owner does not accept a story by the end of the iteration?</b><br><ul><li>The team does not get credit for the story's points in its velocity calculation.</li><li>The story should be sliced to reflect the work completed.</li><li>The acceptance criteria should be adjusted to reflect the work completed.</li><li>The story should be shown to stakeholders for their feedback.</li></ul>,The story should be shown to stakeholders for their feedback.
<b> Which statement is not true about the product backlog?</b><br><ul><li>It is a list of work items that are behind schedule.</li><li>The items are maintained in priority order.</li><li>Anyone on the team can propose an item for it.</li><li>It includes all of the work to be done.</li></ul>,It is a list of work items that are behind schedule.
<b> A project has some major risks that the team wants to mitigate. What is the best way to monitor how well this effort is going?</b><br><ul><li>risk-based spike</li><li>risk-adjusted backlog</li><li>risk velocity chart</li><li>risk burndown graph</li></ul>,risk burndown graph
"<b> The VP of Engineering wants to start giving out a ""Team Member of the Sprint"" award to recognize a top performer in each group. What advice should you give this VP?</b><br><ul><li>This is unhelpful unless there has been recent employee feedback indicating that people feel underappreciated.</li><li>This is a good idea as long as a different person is recognized in each sprint.</li><li>This is a good idea because awards can motivate people to do their best.</li><li>This is unhelpful because it can destroy the team unity essential to achieving high performance.</li></ul>",This is unhelpful because it can destroy the team unity essential to achieving high performance.
<b> What is a difference between a team's task board and a Kanban?</b><br><ul><li>A Kanban has an explicit rule to limit WIP.</li><li>A Kanban shows the backlog of work.</li><li>A Kanban does not use a Definition of Done.</li><li>A Kanban shows the status of the work items.</li></ul>,A Kanban has an explicit rule to limit WIP.<br><br>[Source](https://www.lucidchart.com/blog/kanban-vs-scrum#:~:text=Kanban%20vs%20scrum) `Explicit rule applies to scrum team's task board: tasks cannot be added to the scrum board in the middle of a sprint.`<br>
"<b> The team complains that ""things have been falling through the cracks lately."" What should you do?</b><br><ul><li>Ask the team's manager to make role assignments so the team can catch up.</li><li>Conduct a workshop to identify all of the things that need to be done and see who can help with each.</li><li>Refer to the team's RACI (Responsible, Accountable, Consulted, Informed) assignments.</li><li>Meet with the Tech Lead and Product Owner to try to identify what can be done.</li></ul>",Conduct a workshop to identify all of the things that need to be done and see who can help with each.
"<b> In Large-Scale Scrum, what is the recommended ratio of Scrum Masters to teams?</b><br><ul><li>One Scrum Master can support up to five teams.</li><li>Large teams should have two Scrum Masters.</li><li>There should be one Scrum Master per team.</li><li>One Scrum Master can support one to three teams.</li></ul>",One Scrum Master can support one to three teams.
"<b> In the Cynefin framework, where are ""best practices"" most appropriate?</b><br><ul><li>in the Complex regime</li><li>in the Complicated regime</li><li>in the Chaotic regime</li><li>in the Obvious regime</li></ul>",in the Obvious regime
"<b> A manager informs you that a developer from another team is between assignments, and she wants to place the developer on your team for a few sprints. What should you do?</b><br><ul><li>Explain to the manager that this will be disruptive to the team and ask that another assignment be found.</li><li>Explain the situation to the team and ask them to go with the flow.</li><li>Explain the situation to your manager and ask them to resolve it.</li><li>When the temporary developer shows up, assign them to write documentation.</li></ul>",Explain to the manager that this will be disruptive to the team and ask that another assignment be found.
<b> The Product Owner complains to you that the team is not working hard enough and they need to increase their velocity by at least </b><br><ul><li>Share the feedback from the PO and challenge the team to increase their velocity.</li><li>Ask the PO to explain the business context to the team.</li><li>Explain the impact of technical debt to the PO and the benefits of devoting some capacity to reducing it.</li><li>Hold a Value Stream Mapping workshop to identify and reduce waste.</li></ul>,Share the feedback from the PO and challenge the team to increase their velocity.
<b> What is the name of the practice in which a cross-functional team collaborates intensively to develop a new product idea?</b><br><ul><li>Hackathon</li><li>Scrum at Scale</li><li>Innovation and Planning</li><li>Magnum Focus</li></ul>,Hackathon
<b> The team's manager wants to attend the Sprint Retrospective. What should you do?</b><br><ul><li>Agree to the manager's request and notify the team.</li><li>Propose that the manager attend only every other retrospective.</li><li>Propose a different forum for the manager to meet with the team.</li><li>Ask the team if it is okay with them that the manager attend.</li></ul>,Propose a different forum for the manager to meet with the team.
<b> Who is responsible for a Scrum team's performance?</b><br><ul><li>the team</li><li>the Scrum Master</li><li>the Product Owner</li><li>the Engineering Manager</li></ul>,the team
"<b> Which statement concerning small, frequent releases of software is true?</b><br><ul><li>The chance for rollback is high.</li><li>It typically requires a high degree of automation.</li><li>The administrative costs are high.</li><li>Backward compatibility may be jeopardized.</li></ul>",It typically requires a high degree of automation.
<b> What is the activity of clarifying and expanding user stories called?</b><br><ul><li>story point estimating</li><li>Definition of Done</li><li>user story expansion</li><li>backlog refinement</li></ul>,backlog refinement
"<b> Which strategy is preferred for development teams?</b><br><ul><li>Optimize for most work done.</li><li>Maximize output and maximize outcome.</li><li>Maximize outcome while minimizing output.</li><li>Optimize for resource utilization.`“…your job is to minimize output, and maximize outcome and impact.” - Jeff Patton`<br></li></ul>",Maximize outcome while minimizing output.
<b> Which statement is true about the actor in a user story?</b><br><ul><li>The actor does not have to be a specified role in the solution.</li><li>There must be multiple personas for each actor.</li><li>The actor can be the system itself.</li><li>The system cannot be the actor.</li></ul>,The actor can be the system itself.
"<b> Which statement is true about Agile?</b><br><ul><li>Agile requires a high degree of up-front planning.</li><li>Once the requirements are agreed to, the team can complete work.</li><li>Agile requires a high degree of discipline.</li><li>Agile works best when there is no contract.</li></ul>",Agile requires a high degree of discipline.
<b> Which statement about burndown and burnup charts is not true?</b><br><ul><li>Burndown charts show the work remaining to be done.</li><li>Burnup charts show the work completed.</li><li>Burndown charts are more useful than burnup charts.</li><li>Agile project management tools can produce these automatically.</li></ul>,Burndown charts are more useful than burnup charts.
<b> What is the name for the practice of going to see a process in use at the point of value delivery?</b><br><ul><li>Six Sigma</li><li>Gemba walk</li><li>Total Quality Management</li><li>Kaizen</li></ul>,Gemba walk
"<b> When the team needs to make a decision, what is the best course of action?</b><br><ul><li>Try to achieve concensus.</li><li>Take a vote and the majority rules.</li><li>Identify the person who is most knowledgeable and ask them to decide.</li><li>Let the most senior member of the team decide.</li></ul>",Try to achieve concensus.
<b> Which action is something the Team Facillitator should NOT do?</b><br><ul><li>Embrace servant leadership.</li><li>Estimate story points.</li><li>Celebrate successes.</li><li>Remove impediments</li></ul>,Estimate story points.
"<b> A team needs to do research, design, prototyping. What is this type of story called?</b><br><ul><li>Exploratory spike</li><li>Backlog refinement</li><li>Functional decomposition</li><li>R&D</li></ul>",Exploratory spike
<b> Which statement about technical debt is true?</b><br><ul><li>Technical debt is another name for bugs</li><li>It is at the Product Owner's description to allocate effort to reduce technical debt.</li><li>Adding technical debt should be avoided at all costs.</li><li>Technical debt is what the Product Owner owes to the developers if they work a lot of overtime to complete the sprint.</li></ul>,Adding technical debt should be avoided at all costs.
"<b> Which statement about estimating is not true?</b><br><ul><li>Absolute estimating is more reliable than relative estimating.</li><li>Relative estimating is more reliable than absolute estimating.</li><li>In estimating, accuracy is more important than precision.</li><li>In estimating, the effort is more important than the time required.</li></ul>",Absolute estimating is more reliable than relative estimating.
<b> Which ceremony should the Product Owner not attend?</b><br><ul><li>daily stand-ups</li><li>Sprint Retrospectives</li><li>story point estimating</li><li>code reviews</li></ul>,code reviews
<b> Which task is not the Product Owners responsibility?</b><br><ul><li>estimating story points</li><li>refining acceptance criteria</li><li>giving feedback to developers about the user stories</li><li>demonstrating the work to stakeholders</li></ul>,giving feedback to developers about the user stories
<b> Which choice is `_not_` considered during Sprint Planning?</b><br><ul><li>stories that meet the Definition of Done</li><li>team velocity</li><li>stories that meet the Definition of Ready</li><li>team capacity</li></ul>,stories that meet the Definition of Done
"<b> You have noticed a pattern that the most interesting stories on the Sprint Backlog get started right away, and the least interesting stories languish or don't get done. What should you do?</b><br><ul><li>Use a lottery system assign each story.</li><li>Share your observation with the team and invite them to own and solve the problem.</li><li>During story point estimation increase the points assigned to the least interesting stories so the team can boost their velocity.</li><li>Ask the Tech Lead to assign every story to a developer so they all get done efficiently and with accountability.</li></ul>",Ask the Tech Lead to assign every story to a developer so they all get done efficiently and with accountability.
"<b> What Agile practice best supports this principle: ""At regular intervals, the team reflects on how to become more effective, then tunes and adjusts its behavior accordingly""?</b><br><ul><li>Sprint Review</li><li>Sprint Retrospective</li><li>daily stand-up</li><li>Sprint Demo</li></ul>",Sprint Retrospective
"<b> On what are personas typically based?</b><br><ul><li>a sponsors or team members' personalities and traits</li><li>what the developers think is user friendly</li><li>real people, archetypal users, or composites of multiple users</li><li>descriptions of the product's functionality and use</li></ul>","real people, archetypal users, or composites of multiple users"
<b> Which statement describes Shu Ha Ri?</b><br><ul><li>It is a library of coding patterns.</li><li>It is a software testing strategy.</li><li>It is a standard for interface design.</li><li>It is a model for skill development and mastery.</li></ul>,It is a model for skill development and mastery.
<b> What does the Agile Manifesto indicate?</b><br><ul><li>Responding to change is more valuable than following a plan.</li><li>Documenting requirements up front is more valuable than at the end.</li><li>Following the plan is essential for not going over budget.</li><li>Contract negotiation should be used to settle disputes.</li></ul>,Responding to change is more valuable than following a plan.
<b> What is the main benefit of a working agreement?</b><br><ul><li>It specifies core working hours.</li><li>It clarifies the reporting relationships on the team.</li><li>It defines the culture that the team aspires to achieve.</li><li>It compiles everyone's information.</li></ul>,It defines the culture that the team aspires to achieve.
<b> What is the name of the information radiator that has multiple columns used to visualize the flow of work?</b><br><ul><li>Work Flow Indicator</li><li>Value Stream Map</li><li>Story Map</li><li>Kanban Board</li></ul>,Kanban Board
"<b> Which is the best definition of story points?</b><br><ul><li>They are a relative measure of the effort needed to complete a story.</li><li>They a measure of development time only, test time is considered separately.</li><li>They are a relative measure of the value of a story.</li><li>They are a measure of time to complete a story.</li></ul>",They are a relative measure of the effort needed to complete a story.
<b> What is a Scrum of Scrums?</b><br><ul><li>It is technique for two or more teams working together coordinate their efforts.</li><li>It is another name for the Scrum Master Community of Practice.</li><li>It is an information radiator used to compare the velocity of several teams.</li><li>It is the system demo for teams on the same release train.</li></ul>,It is technique for two or more teams working together coordinate their efforts.
<b> What is the Product Owner's role regarding the product backlog?</b><br><ul><li>The PO must identify the intended users of the features on the backlog.</li><li>The PO is responsible for estimating the size of the total.</li><li>The PO must identify the dependencies that impact the backlog.</li><li>The PO decides what to include in the backlog and what to exclude.</li></ul>,The PO must identify the dependencies that impact the backlog.
"<b> Why should a team do refactoring?</b><br><ul><li>It assigns developers to other teams in order to eliminate personality conflicts.</li><li>It improves the functionality of the product,</li><li>It recalibrates the success criteria for the product in the marketplace.</li><li>It improves the design, which can lead improved development efficiency and maintainability.</li></ul>","It improves the design, which can lead improved development efficiency and maintainability."
<b> Which choice is not a benefit generally associated with product demonstrations?</b><br><ul><li>Learn about new requirements.</li><li>Learn feature suitability.</li><li>Learn about feature usability.</li><li>Learn about feature estimates.</li></ul>,Learn about feature estimates.
<b> What is an information radiator?</b><br><ul><li>a list of KPIs for the team</li><li>a list of overdue action items</li><li>the task board</li><li>a highly visible display of key performance data</li></ul>,the task board
"<b> According to the Agile Manifesto, your highest priority is to \_.</b><br><ul><li>minimize change requests</li><li>satisfy the customer</li><li>get the job done on time</li><li>achieve the desired ROI</li></ul>",satisfy the customer
<b> Product development organizations sometimes use descriptions of archetypal users and their values so that developers can design the system to meet their needs and wants. What are these descriptions called?</b><br><ul><li>actors</li><li>roles</li><li>agents</li><li>personas</li></ul>,personas
<b> The Product Owner is focused on testing a new system concept in the marketplace as quickly and inexpensively as possible. What is this first-generation product called?</b><br><ul><li>preproduction version</li><li>focus group demonstrator</li><li>Generation 1 product</li><li>minimum viable product</li></ul>,minimum viable product
<b> To whom should the Product Owner report?</b><br><ul><li>the Quality Manager</li><li>the Product Manager</li><li>the Scrum Master</li><li>the Engineering Manager</li></ul>,the Product Manager
<b> What happens in Sprint </b><br><ul><li>The team delivers no story points in that sprint.</li><li>The team does regression testing prior to release to production.</li><li>The team prepares to work on the product backlog.</li><li>This is the time to inspect and adapt.</li></ul>,The team prepares to work on the product backlog.
<b> What does the Definition of Done mean?</b><br><ul><li>The story meets the INVEST criteria.</li><li>The team has completed all of the work in its Sprint.</li><li>The story has been handed off to the DevOps team.</li><li>The team has agreed on the criteria for story completion.</li></ul>,The team has agreed on the criteria for story completion.
<b> Which element is most important when describing your product?</b><br><ul><li>its cost</li><li>its licensing terms and conditions</li><li>its benefits</li><li>its features</li></ul>,its benefits
<b> Which choice best describes the Team Facilitator?</b><br><ul><li>a meeting scheduler</li><li>a record keeper</li><li>a project manager</li><li>an Agile coach</li></ul>,an Agile coach
<b> What is the name of the technique that divides a story into smaller pieces?</b><br><ul><li>mitosis</li><li>story slicing</li><li>disaggregation</li><li>Divide and Conquer</li></ul>,disaggregation
<b> A team member comes to you with a complaint about another team member. What should you do?</b><br><ul><li>Bring the complaint to the other person and try to resolve the issue.</li><li>Ask them to talk to the other person and try to work it.</li><li>Notify HR of the problem and ask them to handle it.</li><li>Invite both people a meeting and try mediate the conflict.</li></ul>,Invite both people a meeting and try mediate the conflict.
"<b> What is the forming-storming-norming, performing model of team development known as?</b><br><ul><li>the Tuckman model</li><li>the Standard Team model</li><li>Moore's Team Framework</li><li>the Siebert model</li></ul>",the Tuckman model
"<b> What is the name of the ceremony in which you inspect the work completed during the sprint?</b><br><ul><li>Sprint Retrospective</li><li>Sprint Review</li><li>Next-Sprint Planning</li><li>Velocity Confirmation`Sprint Retrospective: Reflect on the previous sprint, discuss what’s working well, what could be improved, and how to improve it to be more productive.`<br></li></ul>",Sprint Review<br><br>[Source](https://startinfinity.com/product-management-framework/scrum-sprint/sprint-review-vs-sprint-retrospective) `Sprint Review: Discuss what has been accomplished during the sprint and whether the sprint goal has been met.`<br>
<b> Which choice best describes an Agile Release Train (ART)?</b><br><ul><li>continuous delivery</li><li>comprised of the teams within a program</li><li>DevOps Center of Excellence</li><li>Scrum of Scrums</li></ul>,continuous delivery
"<b> As an Agile coach, what should be your attitude toward your team members individual goals and motivations?</b><br><ul><li>Understand them—try align personal motivations with the team's progress toward the project goals.</li><li>Nurture them-goals are the reason why people want to be at work.</li><li>Disregard them—personal views have no bearing on reaching the project goals.</li><li>Leverage them—use personal goals encourage team members raise their performance levels.</li></ul>",Leverage them—use personal goals encourage team members raise their performance levels.
<b> Which phrase best describes an Agile team?</b><br><ul><li>self-directed</li><li>self-managed</li><li>self-sustaining</li><li>self-organizing</li></ul>,self-organizing
<b> Which technique does not help prioritize the backlog?</b><br><ul><li>MoSCow</li><li>Kano</li><li>WSJF</li><li>Kaizen</li></ul>,Kaizen
