<b> What does the Definition of Ready mean?</b><br><ul><li>The story has been tested end is ready for release to production.</li><li>The story is ready to be brought into a sprint.</li><li>The stakeholders are ready to discuss their requirements for story.</li><li>The team has completed sprint 0 and is ready to work.</li></ul>,The story is ready to be brought into a sprint.<br><br>[Source](https://www.scruminc.com/definition-of-ready/) `Definition of Ready means that stories must be immediately actionable. The Team must be able to determine what needs to be done and the amount of work required to complete the User Story.`<br>
<b> Which is NOT a principle of the Scaled Agile Framework?</b><br><ul><li>Centralize decision-making</li><li>Apply systems thinking</li><li>Take an economic view</li><li>Unlock the intrinsic motivation of knowledge workers</li></ul>,Centralize decision-making<br><br>[Source: Underlying principles of SAFe](https://en.wikipedia.org/wiki/Scaled_agile_framework#Underlying_principles_of_SAFe)<br>
"<b> What is the definition of capacity?</b><br><ul><li>It is an inventory of the team's knowledge and skills that is used to plan the work that they do.</li><li>It is the number of teams that a Team Facilitator can support concurrently.</li><li>It is an adjustment to velocity, used in Spring Planning, to account for reduced availability of team members during the upcoming sprint.</li><li>It is the maximum number of stories that will be allowed in a sprint.</li></ul>",It is the maximum number of stories that will be allowed in a sprint.
"<b> The team is complaining that they send request for clarification to the Product Owner, but these requests go unanswered. What action should you take?</b><br><ul><li>If there is a question about story, tell the developers to use their best judgement, avoid delay, and discuss the issue in sprint review.</li><li>Send a note to the Product Owner saying the delays in completing the work will be their responsibility, not the team's.</li><li>Develop a service-level agree (SLA) that defines certain response times for different types of request and ask the Product Owner to sign off on it.</li><li>Schedule a problem-solving session with the Product Owner and the other team members.</li></ul>",Schedule a problem-solving session with the Product Owner and the other team members.
<b> Which choice is a pillar of Lean?</b><br><ul><li>Frequent delivery of working software</li><li>Respect for people and culture</li><li>Courage</li><li>Sustainable pace</li></ul>,"Respect for people and culture<br><br>[Source](https://www.planview.com/resources/guide/lean-principles-101/what-is-lean/#:~:text=The%20Pillars%20of%20Lean) `Two pillars are (1) Continuous Improvement, and (2) Respect for People.`<br>"
"<b> Which statement best describes Agile, Lean, and Six Sigma?</b><br><ul><li>They are strategies for delivering customer value.</li><li>They were pioneered by Toyota.</li><li>They are strategies for discovering what the customer wants.</li><li>They are derived from statistical process control.</li></ul>",<ul></ul>
<b> What is a user story?</b><br><ul><li>A description of what an actor wants to do in order to accomplish a goal</li><li>A description of archetypal users so the developers can make the solution user-friendly</li><li>A report from the field about a user's experience with the product</li><li>The Agile term for a requirement</li></ul>,The Agile term for a requirement
<b> What is the expected output of a Planning Poker meeting?</b><br><ul><li>The stories were discussed and each had a story point estimate assigned.</li><li>The team gave feedback to the Product Owner about the acceptance criteria.</li><li>The team decided what stories should be developed within the same sprint.</li><li>The team made a preliminary plan for which stories will be completed in the next quarter.</li></ul>,The stories were discussed and each had a story point estimate assigned.
<b> What is the definition of velocity?</b><br><ul><li>The number of story points delivered during a sprint</li><li>The average waiting time for a story on the sprint backlog</li><li>The average wait time for a story to move from the product backlog to the sprint backlog</li><li>The time it takes a developer to complete a story divided by its relative value</li></ul>,The number of story points delivered during a sprint
<b> What is most important for a successful Product Owner to understand?</b><br><ul><li>The budget for the product.</li><li>The underlying technology of the product.</li><li>The development team's strengths and weaknesses.</li><li>The business context for the product.</li></ul>,"The business context for the product.<br><br>[Source](https://premieragile.com/how-does-a-product-owner-measure-value) `A Scrum Team has 3 roles - Product Owner, Scrum Master and Developers. All 3 roles generate Value in their own contexts; however, it is the Product Owner who maximizes the Value from a product or business context.`<br>"
<b> Which statement about the Agile Manifesto is true?</b><br><ul><li>It was written via crowdsourcing and its authors are unknown.</li><li>It has been translated into dozens of languages and used around the world.</li><li>It was written in 2001 and is obsolete.</li><li>It was first published as part of Jim Highsmith's doctoral thesis.</li></ul>,It has been translated into dozens of languages and used around the world.
"<b> The team is not going to complete its Spring Commitment. As the Team Facilitator, what should you do?</b><br><ul><li>Ask the PO to extend the sprint.</li><li>Advise the PO as soon as possible.</li><li>Report this at the Sprint Review.</li><li>Point out the reasons why and collaborate on solutions.</li></ul>",<ul></ul>
"<b> When a user story is further decomposed, what are the elements called?</b><br><ul><li>technical tasks</li><li>actors and actions</li><li>Who, What, Why</li><li>threads</li></ul>","Who, What, Why"
"<b> What does collective ownership mean?</b><br><ul><li>Every member of the team can make changes to any part of the code as necessary.</li><li>If someone is at fault, then the whole team is at fault.</li><li>The team shares equally in the profits that the product generates.</li><li>The team, not the individuals, receive performance evaluations.</li></ul>",The team shares equally in the profits that the product generates.
"<b> According to the Agile Manifesto, how often should developers and business people work together?</b><br><ul><li>as often as needed</li><li>biweekly</li><li>daily</li><li>weekly</li></ul>",daily
<b> What do you call the practice of writing a test before the code is written?</b><br><ul><li>design for testability</li><li>test-driven development</li><li>unit testing</li><li>test then code</li></ul>,test-driven development
"<b> What is the term for a team member who is ""T-skilled""?</b><br><ul><li>cross-functional</li><li>jack-of-all-trades</li><li>apprentice developer</li><li>generalizing specialist</li></ul>",cross-functional
"<b> Which statement is _not_ true about pair programming?</b><br><ul><li>It has been discredited because it is too expensive.</li><li>In pair programming, two developers share one computer and take turns at the keyboard.</li><li>It is a great way to teach someone who is new to the team.</li><li>The code produced by two developers who are collaborating is typically higher quality than if they were working alone.</li></ul>","In pair programming, two developers share one computer and take turns at the keyboard."
<b> People with fixed mindset \_ .</b><br><ul><li>have better focus and longer attention spans</li><li>are more goal oriented</li><li>tend to be more resilient</li><li>are more afraid of failure</li></ul>,have better focus and longer attention spans
"<b> How can you impove interaction between team members?</b><br><ul><li>Move people's workstations around in the team room to create new social possibilities.</li><li>Ask the team if they would like to do something recreational together and offer to organize it.</li><li>Tell the team that you see this as a problem and ask them to solve it.</li><li>Since no one has come to you with a complaint, assume that the limited interaction works for everyone.</li></ul>",Move people's workstations around in the team room to create new social possibilities.
<b> What is the expected outcome of the daily stand-up meeting?</b><br><ul><li>updated status on all of the work</li><li>team alignment on its plan for the day</li><li>a list of impediments and priorities</li><li>a report to the Product Owner of stories ready to be accepted</li></ul>,team alignment on its plan for the day
"<b> What is the name of the technique in which a story includes an input, a translation of input to output, and an output?</b><br><ul><li>input-output processing</li><li>ITIOO story format</li><li>thin vertical slice</li><li>structured coding</li></ul>",<ul></ul>
"<b> What is the term for a team member who is ""T-shaped""?</b><br><ul><li>cross-functional</li><li>jack-of-all-trades</li><li>generalizing specialist</li><li>apprentice developer</li></ul>",cross-functional<br><br>[Source](https://www.adventureswithagile.com/2017/07/12/heres-thing-t-shaped-people/) `One of the challenges for organisations when they move to Agile ways of working is the often mentioned need to build teams made up of “T-shaped” people. This can also be described as a cross-functionality.`<br>
"<b> What is a lean canvas?</b><br><ul><li>decompose solution into epics, features, and stories</li><li>template for lightweight business plans that makes your assumptions explicit</li><li>tool to plan future project releases</li><li>technique for projecting growth in market share.</li></ul>",template for lightweight business plans that makes your assumptions explicit<br><br>[Source](http://ask.leanstack.com/en/articles/901274-what-is-a-lean-canvas) `1-page business plan template that helps you deconstruct your idea into its key assumptions using 9 basic building blocks.`<br>
"<b> The team is not going to complete its Sprint Commitment. As Team Facilitator, what should you do?</b><br><ul><li>advise the PO as soon as possible</li><li>point out the reasons why and collaborate on solutions</li><li>report this at the Sprint Review</li><li>Ask the PO to extend the sprint</li></ul>","Ask the PO to extend the sprint<br><br>[Source](https://mcqpoint.com/question/what-happens-when-all-the-sprint-items-cannot-be-completed/) `non verified answer - extend, otherwise goes to backlog`<br>"
<b> Which of these traits is most important for being an effective Team Facilitator?</b><br><ul><li>being self-aware</li><li>being extroverted</li><li>having type A personality (def not this :P)</li><li>being someone who takes charge</li></ul>,"being self-aware<br><br>[Source](https://www.globalknowledge.com/us-en/course/87262/agile-team-facilitation-icp-atf/) `non verified answer - A facilitator is someone who helps a group identify common objectives and then offers group processes to achieve defined outcomes while maintaining neutrality. A skilled facilitator consciously embodies self-awareness, self-management, and bias management, while conveying openness and enthusiasm. `<br>"
