"<b> What is the purpose of the `fixture.detectChanges()` call in this unit test?</b><br><br>```ts<br>TestBed.configureTestingModule({<br>declarations: [UserCardComponent],<br>});<br>let fixture = TestBed.createComponent(UserCardComponent);<br>fixture.detectChanges();<br>expect(fixture.nativeElement.querySelector('h1').textContent).toContain(<br>fixture.componentInstance.title,<br>);<br>```<br><br><ul><li>It tracks any potential Ul changes and will fail the unit test if any are made.</li><li>It is used to ensure component template stability across multiple unit tests in the entire test suite.</li><li>It forces Angular to perform change detection, which will render the _UserCardComponent_ before you can validate its template.</li><li>It is used to log change-detection events to the console during unit test runs.</li></ul>","It forces Angular to perform change detection, which will render the _UserCardComponent_ before you can validate its template.<br><br>[angular.io](https://angular.io/api/core/testing/ComponentFixture#detectChanges)<br>"
"<b> What will the URL segment look like based on the following call to the `Router.navigate` method when goToUser is passed the value </b><br><br>```ts<br>export class ToolsComponent {<br>constructor(private router: Router) {}<br>goToUser(id: number) {<br>this.router.navigate(['user', id]);<br>}<br>}<br>```<br><br><ul><li>/user/15</li><li>/user?id=15</li><li>/user:15</li><li>/user;id=15</li></ul>",/user/15<br><br>[angular.io](https://angular.io/api/router/Router#navigate)<br>
"<b> When a service is provided for root and is also added to the provider's configuration for a lazy-loaded module, what instance of that service does the injector provide to constructors in the lazy-loaded module?</b><br><ul><li>A new instance of that service is created when the module is lazy loaded.</li><li>Providing a service of the same type at a lazy-loaded module level is not allowed.</li><li>If an instance of the service has not been created at the root level yet. it will create one there and then use it.</li><li>A single instance of that service is always instantiated at root and is the only one ever used, including within lazy modules.</li></ul>",A new instance of that service is created when the module is lazy loaded.
"<b> What is the HostBinding decorator doing in this directive?</b><br><br>```ts<br>@Directive({<br>selector: ' [appHighlight] ',<br>})<br>export class HighlightDirective {<br>@HostBinding('class.highlighted') highlight = true;<br>}<br>```<br><br><ul><li>It is adding the CSS class named highlighted to any DOM element that has the appHighlight directive on it.</li><li>HostBinding does not do anything on directives, only on components.</li><li>It is specifying if the host element gets the highlighted class added to its class attribute, then the directive class field highlight will get set to true; and if it is not added on the host it will get set to false.</li><li>It is creating an inline style on the host element with a CSS property named highlight set to true.</li></ul>",It is adding the CSS class named highlighted to any DOM element that has the appHighlight directive on it.<br><br>[StackOverflow](https://stackoverflow.com/a/46207423)<br>
"<b> In reactive forms, what Angular form class type is used on the native DOM <form> element to wire it up?</b><br><ul><li>`FormArray`</li><li>`FormControl`</li><li>`FormGroup`</li><li>`all of these answers`</li></ul>",`FormGroup`
"<b> Assuming the username FormControl has been configured with a minLength validator, how can you set up an error display in the following reactive forms markup for the username field?</b><br><br>```html<br><form [formGroup]=""form""›<br><input type=""text"" formControlName= ""username""›<br>...<br></form><br>```<br><br><ul><li>A```ts<br><span *ngIf=""username.minLength.invalid""›<br>Username length is not valid<br></span><br>```<br></li><li>B```ts<br><input type=""text"" formControlName=""username"" [showMinLength]=""true""›<br>```<br></li><li>C```ts<br><span *ngIf=""form.get('username').getError('minLength') as minLengthError""><br>Username must be at least {{ minLengthError.requiredLength }} characters.<br></span><br>```<br></li><li>D```ts<br><input type=""text"" formControlName=""username"" #userName=""ngModer""><br><span *ngIf=""userName.errors.minlength""›<br>Username must be at least {{ userName.errors.minlength.requiredLength }} characters.<br></span><br>```<br></li></ul>","D```ts<br><input type=""text"" formControlName=""username"" #userName=""ngModer""><br><span *ngIf=""userName.errors.minlength""›<br>Username must be at least {{ userName.errors.minlength.requiredLength }} characters.<br></span><br>```<br><br><br>[Codecraft](https://codecraft.tv/courses/angular/forms/template-driven/)<br>"
<b> How does the emulated view encapsulation mode handle CSS for a component?</b><br><ul><li>It renders the CSS exactly how you wrote it without any changes.</li><li>It makes use of shadow DOM markup and CSS.</li><li>It creates unique attributes for DOM elements and scopes the CSS selectors you write to those attribute ids.</li><li>It renders all of the CSS rules you write as inline CSS on all of the DOM elements you use them on in the template.</li></ul>,It creates unique attributes for DOM elements and scopes the CSS selectors you write to those attribute ids.<br><br>[Angular.io](https://angular.io/guide/view-encapsulation#inspecting-generated-css)<br>
"<b> With the following TestBed setup, what can be used to access the rendered DOM for the UserCardComponent?</b><br><br>```ts<br>TestBed.configureTestingModule({<br>declarations: [UserCardComponent],<br>});<br>let fixture = TestBed.createComponent(UserCardComponent);<br>```<br><br><ul><li>`fixture.componentTemplate`</li><li>`fixture.getComponentHtml()`</li><li>`fixture.nativeElement`</li><li>`fixture.componentInstance.template `1. [StackOverflow](https://stackoverflow.com/a/56504773)<br>2. [Angular.io](https://angular.io/guide/testing-components-basics#nativeelement)<br></li></ul>",`fixture.nativeElement`
"<b> Given these two components, what will get rendered to the DOM based on the markup usage?</b><br><br>```ts<br>@Component({<br>selector: 'app-card',<br>template: '<h1>Data Card</h1><ng-content></ng-content>'<br>})<br>export class CardComponent { }<br>@Component({<br>selector: 'app-bio',<br>template: '<ng-content></ng-content>.<br>})<br>export class BioComponent { }<br>// markup usage:<br><app-card><app-bio>Been around for four years.</app-bio></app-card><br>```<br><br><ul><li>A```ts<br><app-card><br><h1>Data Card</hl><br><app-bio><br>Been around for four years.<br></app-bio><br></app-card><br>```<br></li><li>B```ts<br><h1>Data Card</h1><br><app-bio><br>Been around for four years.<br></app-bio><br>```<br></li><li>C```ts<br><app-card><br><h1>Data Card</hl><br><ng-content></ng-content><br><app-bio><br>Been around for four years.<br><ng-content></ng-content><br></app-bio><br></app-card><br>```<br></li><li>D```ts<br><app-card><br><h1>Data Card</hl><br></app-card><br>```<br></li></ul>",A```ts<br><app-card><br><h1>Data Card</hl><br><app-bio><br>Been around for four years.<br></app-bio><br></app-card><br>```<br>
"<b> Given the app-title-card component in the code below, what DOM will the app-user-card component render?</b><br><br>```ts<br>@Component({<br>selector: 'app-user-card',<br>template: '<app-title-card></app-title-card><p>Jenny Smith</p>'<br>})<br>@Component({<br>selector: 'app-title-card',<br>template: '<h1>User Data</hl>'<br>})<br>// usage of user card component in parent component html<br><app-user-card></app-user-card><br>```<br><br><ul><li>A```ts<br><app-user-card><br><app-title-card><br><h1>User Data</h1><br></app-title-card><br><p>Jenny Smith</p><br></app-user-card><br>```<br></li><li>B```ts<br><h1>User Data</h1><br><p>Jenny Smith<p><br>```<br></li><li>C```ts<br><app-user-card><br><app-title-card></app-title-card><br></app-user-card><br>```<br></li><li>D```ts<br><div app-user-card><br><h1 app-title-card>User Data</h1><br><p>Jenny Smith</p><br></div><br>```<br></li></ul>",A```ts<br><app-user-card><br><app-title-card><br><h1>User Data</h1><br></app-title-card><br><p>Jenny Smith</p><br></app-user-card><br>```<br>
"<b> Pick the matching code for the custom provider registration that the @Inject () decorator is looking for:</b><br><br>```ts<br>constructor(@Inject('Logger') private logger) { }<br>```<br><br><ul><li>A```ts<br>providers: [Logger];<br>```<br></li><li>B```ts<br>providers: [{ provide: 'Logger', useClass: Logger }];<br>```<br></li><li>C```ts<br>@Injectable({<br>providedln: 'root'<br>})<br>```<br></li><li>D```ts<br>providers: [{ provide: 'Logger' }];<br>```<br>1. [StackOverflow](https://stackoverflow.com/a/37315355)<br>2. [TektutorialHub](https://www.tektutorialshub.com/angular/angular-injector-injectable-inject/)<br>3. [Angular.io - Dependency Injection In Action](https://angular.io/guide/dependency-injection-in-action#supply-a-custom-provider-with-inject)<br></li></ul>","B```ts<br>providers: [{ provide: 'Logger', useClass: Logger }];<br>```<br>"
"<b> Which choice best describes the following usage of the HttpClient.get method in the getsettings class method?</b><br><br>```ts<br>export class SettingsService {<br>constructor(private httpClient: HttpClient) { }<br>...<br>getSettings()<br>{<br>return this.httpClient.get<Settings>(this.settingsUrl)<br>.pipe(<br>retry(3)<br>);<br>}}<br>```<br><br><ul><li>The RxJs pipe method is an alias for the subscribe method, so a call to `getSettings` will execute the get query. The retry operator is used to tell the pipe call to retry the get query three times.</li><li>It will produce an error at runtime because the pipe method is not available off of the `Httpclient.get` call.</li><li>Every single call to the getSettings method will result in the Httpclient making three total get requests to the settingsUrl, which is not ideal because there will always be two extra calls that are not needed. The retry operator should not be used in this manner.</li><li>When the result of the getSettings method is subscribed to, the HTTP GET call will be made; if it fails, it will be retried up to three times before it gives up and returns an error.1. [learnrxjs.io](https://www.learnrxjs.io/learn-rxjs/operators/error_handling/retry)<br>2. [dev.to](https://dev.to/gparlakov/how-does-rxjs-retry-work-412p)<br></li></ul>","When the result of the getSettings method is subscribed to, the HTTP GET call will be made; if it fails, it will be retried up to three times before it gives up and returns an error.1. [learnrxjs.io](https://www.learnrxjs.io/learn-rxjs/operators/error_handling/retry)<br>2. [dev.to](https://dev.to/gparlakov/how-does-rxjs-retry-work-412p)<br>"
"<b> When a service requires some setup to initialize its default state through a method, how can you make sure that said method is invoked before the service gets injected anywhere?</b><br><ul><li>Put the logic of that service method into the service constructor instead.</li><li>Use a factory provider at the root AppModule level that depends on the service to call that service method.</li><li>it is not possible to do it at application start; you can do it only at a component level.</li><li>Instantiate an instance of the service at the global level (window scope) and then call that method.1. [Angular.io](https://angular.io/guide/dependency-injection-providers)<br>2. [Stackoverflow](https://stackoverflow.com/questions/39803876/how-to-use-factory-provider)<br></li></ul>",Use a factory provider at the root AppModule level that depends on the service to call that service method.
"<b> What statement best describes this usage of the TestBed?</b><br><br>```ts<br>const spy = jasmine.createSpyObj('DataService', ['getUsersFromApi']);<br>TestBed.configureTestingModule({<br>providers: [UserService, { provide: DataService, useValue: spy }],<br>});<br>const userService = TestBed.get(UserService);<br>```<br><br><ul><li>The TestBed is required anytime you want to make use of a spy object in a unit test for an Angular provider.</li><li>The TestBed is being used to test a component's view.</li><li>The TestBed scaffolds an NgModule with two providers and handles any dependency injection. If any Angular class requests the DataService in its constructor, the TestBed will inject spy in that constructor.</li><li>The TestBed is configuring the test runner to tell it to only execute tests for the two providers listed in its providers array.- `All other tests be ignored, including tests that assert results against one of these providers and a non-defined provider.`<br>`Although it will work when multiple providers in this configuration are asserted against in a single test.`<br></li></ul>","The TestBed scaffolds an NgModule with two providers and handles any dependency injection. If any Angular class requests the DataService in its constructor, the TestBed will inject spy in that constructor."
<b> What is the primary difference between a component and a directive?</b><br><ul><li>A component uses a selector metadata property and a directive does not.</li><li>A directive can be used for adding custom events to the DOM and a component cannot.</li><li>A component has a template and a directive does not.</li><li>A directive can target only native DOM elements.</li></ul>,A component has a template and a directive does not.<br><br>[StackOverflow](https://stackoverflow.com/a/34616190)<br>
"<b> What could you add to this directive class to allow the truncate length to be set during directive usage in markup?</b><br><br>```ts<br>@Directive({<br>selector: '[appTruncate]'<br>})<br>export class TruncateDirective {<br>. . .<br>}<br>// example of desired usage:<br><p [appTruncate]=""10"">Some very long text here</p><br>```<br><br><ul><li>`@Input() appTruncate: number;`</li><li>`@Output() appTruncate;`</li><li>`constructor(maxLength: number) { }`</li><li>`Nothing. The directive selector cannot be used to pass in values to the directive.`1. [Angular.io](https://angular.io/guide/attribute-directives#passing-values-into-an-attribute-directive)<br>2. [StackOverflow](https://stackoverflow.com/a/46303049)<br></li></ul>",`@Input() appTruncate: number;`
"<b> How can you pass query parameters to this `HttpClient.get` request?</b><br><br>```ts<br>export class OrderService {<br>constructor(private httpClient: HttpClient) {}<br>getOrdersByYear(year: number): Observable<Order[]> {<br>return this.httpClient.get<Order[]>(this.ordersUrl);<br>}<br>}<br>```<br><br><ul><li>A `return this.httpClient.get<Order[]>(this.ordersUrl, {'year': year})`</li><li>B `return this.httpClient.get<Order[]>(this.ordersUrl, year)`</li><li>C```ts<br>const options = { params: new HttpParams().set('year', year) };<br>return this.httpClient.get<Order[]>(this.ordersUrl, options);<br>```<br></li><li>D```ts<br>getOrdersByYear(year: number): Observable<Order[]> {<br>return this.httpClient.addParam('year', year).get<Order[]>(this.ordersUrl, year);<br>}<br>```<br>1. [StackOverflow](https://stackoverflow.com/a/34475594)<br>2. [TektutorialHub](https://www.tektutorialshub.com/angular/angular-pass-url-parameters-query-strings/#httpparams)<br></li></ul>","C```ts<br>const options = { params: new HttpParams().set('year', year) };<br>return this.httpClient.get<Order[]>(this.ordersUrl, options);<br>```<br>"
"<b> Assuming the `DataService` has been registered in the providers for the application, which answer best describes what happens based on this component's constructor?</b><br><br>```ts<br>@Component({<br>...<br>})<br>export class OrderHistoryComponent {<br>constructor(private dataService: DataService) {}<br>...<br>}<br>```<br><br><ul><li>It is declaring that the `OrderHistoryComponent` will have its own version of a `DataService` and that it should never use any existing instances. The `DataService` would need to be instantiated within the class as a private field for this code to be complete and working.</li><li>When Angular creates a new instance of the `OrderHistoryComponent`, the injector will provide an instance of a `DataService` class to the component constructor's first argument. The constructor's `dataService` parameter will be used to set a private instance field with the same name on the instance.</li><li>It provides a way to do component testing only; the constructor has no usage in the actual run of the Angular application.</li><li>It enables the custom element that the component targets to have a custom property named `dataService` that can be used to bind an existing `DataService` instance to.1. [StackOverflow](https://stackoverflow.com/a/49755822)<br>2. [Angular.io - Dependency Injection](https://angular.io/guide/dependency-injection)<br></li></ul>","When Angular creates a new instance of the `OrderHistoryComponent`, the injector will provide an instance of a `DataService` class to the component constructor's first argument. The constructor's `dataService` parameter will be used to set a private instance field with the same name on the instance."
"<b> Finish this markup using the `ngIf` directive to implement an else case that will display the text ""User is not active"":</b><br><br>```ts<br><div *ngIf=""userIsActive; else inactive""><br>Currently active!<br></div><br>```<br><br><ul><li>A```ts<br><div #inactive>User is not active.</div><br>```<br></li><li>B```ts<br><div *ngIf=""inactive""><br>User is not active.<br></div><br>```<br></li><li>C```ts<br><ng-template #else=""inactive""><br><div>User is not active.</div><br></ng-template><br>```<br></li><li>D```ts<br><ng-template #inactive><br><div>User is not active.</div><br></ng-template><br>```<br></li></ul>",D```ts<br><ng-template #inactive><br><div>User is not active.</div><br></ng-template><br>```<br><br><br>[Angular.io](https://angular.io/api/common/NgIf)<br>
"<b> What is the correct syntax for a route definition to lazy load a feature module?</b><br><ul><li>A```ts<br>{<br>path: 'users',<br>lazy: './users/users.module#UsersModule'<br>}<br>```<br></li><li>B```ts<br>{<br>path: 'users',<br>loadChildren: () => import('./users/users.module').then(m => m.UserModule)<br>}<br>```<br></li><li>C```ts<br>{<br>path: 'users',<br>loadChildren: './users/users.module#UsersModule'<br>}<br>```<br></li><li>D```ts<br>{<br>path: 'users',<br>module: UsersModule<br>}<br>```<br></li></ul>","B```ts<br>{<br>path: 'users',<br>loadChildren: () => import('./users/users.module').then(m => m.UserModule)<br>}<br>```<br><br><br>[Angular.io - Lazy Loading Modules](https://angular.io/guide/lazy-loading-ngmodules)<br>"
"<b> Describe how the validation is set up and configured in this reactive forms example:</b><br><br>```ts<br>export class UserFormControl implements OnInit {<br>...<br>ngOnInit() {<br>this.form = this.formBuilder.group({<br>username: this.formBuilder.control('',<br>[Validators.required, Validators.minLength(5), this.unique]),<br>)};<br>}<br>unique(control: FormControl) {<br>return control.value !== 'admin' ? null: {notUnique: true};<br>}<br>}<br>```<br><br><ul><li>The `FormControl` for `username` is getting configured to exclude three validators from the validators that it is allowed to use.</li><li>The `FormControl` for `username` is getting configured to allow three possible validators to be used: `required, maxLength`, and a custom one named `unique`. To enable these `validators`, a validator directive would need to be put on the form fields in the markup.</li><li>Validation cannot be set up this way in reactive forms.</li><li>The `FormControl` for `username` is getting configured with three validators: the `required` and `minLength` validators that come from Angular, and a custom validator function named `unique` that checks for the value not equal to the string `admin`.1. [Angular.io - Form Validation](https://angular.io/guide/form-validation)<br>2. [Angular University Blog](https://blog.angular-university.io/angular-custom-validators/)<br></li></ul>","The `FormControl` for `username` is getting configured with three validators: the `required` and `minLength` validators that come from Angular, and a custom validator function named `unique` that checks for the value not equal to the string `admin`.1. [Angular.io - Form Validation](https://angular.io/guide/form-validation)<br>2. [Angular University Blog](https://blog.angular-university.io/angular-custom-validators/)<br>"
"<b> What does the Injectable decorator do on this service class?</b><br><br>```ts<br>@Injectable({<br>providedIn: 'root'<br>)}<br>export class DataService { }<br>```<br><br><ul><li>It registers a provider for the service that is available only at the root module level, not to any children modules.</li><li>It registers a provider for the service in the root application injector, making a single instance of it available throughout the application.</li><li>It makes it so the service can be injected only in the bootstrapped component for the application.</li><li>It sets up a compile time rule that allows you to put the service type only in the providers metadata property of the root NgModule.</li></ul>","It registers a provider for the service in the root application injector, making a single instance of it available throughout the application.<br><br>[Angular.io](https://angular.io/guide/providers#providing-a-service)<br>"
"<b> Describe the usage of this code</b><br><br>```ts<br>export interface AppSettings {<br>title: string;<br>version: number;<br>}<br>export const APP_SETTINGS = new InjectionToken<AppSettings>('app.settings');<br>```<br><br><ul><li>The InjectionToken is adding an instance of the AppSettings to the root provider via the InjectionToken constructor call, making it automatically available to all NgModules, services and components throughout the Angular application without the need to inject it anywhere.</li><li>The InjectionToken is used to create a provider token for a non-class dependency. An Object literal can be provider as a value for the APP_SETTINGS dependency provider type that can then be injected into components, services, etc ..</li><li>The InjectionToken is used to create a dynamic decorator for the AppSettings that can be used on constructor parameters via an @AppSettings decorator.</li><li>This code has an error since you cannot use a TypeScript interface for the generic type on the InjectionToken</li></ul>","The InjectionToken is used to create a provider token for a non-class dependency. An Object literal can be provider as a value for the APP_SETTINGS dependency provider type that can then be injected into components, services, etc .."
"<b> For the following template-driven forms example, what argument can be passed to the submit method in the click event to submit the data for the form?</b><br><br>```ts<br><form #form=""ngForm""><br><input type=""text"" ngModel=""firstName""><br><input type=""text"" ngModel=""lastName""><br><button (click)=""submit()"">Save</button><br></form><br>```<br><br><ul><li>submit(form.value)</li><li>submit($event)</li><li>submit(ngForm.value)</li><li>submit(FirstName, lastName)</li></ul>",submit(form.value)
"<b> What is the purpose of the `prelodingStrategy` property configuration in this router code?</b><br><br>```ts<br>RouterModule.forRoot(<br>...{<br>preloadingStrategy: PreloadAllModules,<br>},<br>);<br>```<br><br><ul><li>It enables the option to flag individual routes for preloading.</li><li>It preloads all dependencies for routes, creating instances of services when the app first starts up</li><li>It ensures all modules get built into a single app module bundle file.</li><li>It configures the router to immediately load all routes that have a loadChildren property(routes that are typically loaded when requested)References:<br>- [Angular Router, PreloadAllModules](https://angular.io/api/router/PreloadAllModules)<br>- [Route preloading in Angular](https://web.dev/route-preloading-in-angular/)<br>- [Preloading strategy](https://www.tektutorialshub.com/angular/angular-preloading-strategy/)<br>- [Custom preloading strategy](https://www.concretepage.com/angular-2/angular-custom-preloading-strategy#Preloading)<br>- [Preloading strategy, save loading time](https://medium.com/geekculture/preloading-strategy-in-angularsave-loading-time-ca791074fe28)<br></li></ul>","It configures the router to immediately load all routes that have a loadChildren property(routes that are typically loaded when requested)References:<br>- [Angular Router, PreloadAllModules](https://angular.io/api/router/PreloadAllModules)<br>- [Route preloading in Angular](https://web.dev/route-preloading-in-angular/)<br>- [Preloading strategy](https://www.tektutorialshub.com/angular/angular-preloading-strategy/)<br>- [Custom preloading strategy](https://www.concretepage.com/angular-2/angular-custom-preloading-strategy#Preloading)<br>- [Preloading strategy, save loading time](https://medium.com/geekculture/preloading-strategy-in-angularsave-loading-time-ca791074fe28)<br>"
"<b> What is an alternative way to write this markup to bind the value of the class field `userName` to the `h</b><br><br>```html<br><h1 [title]=""userName"">Current user is {{ userName }}</h1><br>```<br><br><ul><li>title=""userName""</li><li>title=""{{ userName }}""</li><li>title=""{{ 'userName' }}""</li><li>The only way to do it is by using the square brackets.</li></ul>","title=""{{ userName }}"""
