"<b> What is the `async` pipe doing in this example?</b><br><br>```ts<br>@Component({<br>selector: 'app-users',<br>template: '<div *ngFor=""let user of users | async"">{{ user.name }}</div>',<br>})<br>export class UsersComponent implements OnInit {<br>users;<br>constructor(private httpClient: HttpClient) {}<br>ngOnInit(): void {<br>this.users = this.httpClient.get<{ name: string }>('users');<br>}<br>}<br>```<br><br><ul><li>It is doing nothing, since the async pipe cannot be used in an `ngFor` statement.</li><li>It is configuring the `ngFor` iteration to support multiple lists of users at the same time.</li><li>It is subscribing to the observable returned from the `HttpClient.get` method and unwrapping the returned value so it can be iterated over in the `ngFor`.</li><li>It is allowing all of the users in the `users` field to be rendered concurrently to the DOM.</li></ul>",It is subscribing to the observable returned from the `HttpClient.get` method and unwrapping the returned value so it can be iterated over in the `ngFor`.
"<b> How would you make use of this directive in markup based on its selector value</b><br><br>```ts<br>@Directive({<br>selector: '[appTruncate]'<br>})<br>export class TruncateDirective{<br>. . .<br>}<br>```<br><br><ul><li>`html <p data-directive=""appTruncate"">Some long text </p> `</li><li>`html <p appTruncate>Some long text</p> `</li><li>`html <p app-truncate>Some long text</p> `</li><li>`html <app-truncate>Some long text</app-truncate> `</li></ul>",`html <p appTruncate>Some long text</p> `
<b> What lifecycle hook can be used on a component to monitor all changes to @Input values on that component?</b><br><ul><li>ngOnInit</li><li>ngChanges</li><li>ngAfterInputChange</li><li>ngOnChanges</li></ul>,ngOnChanges<br><br>[How to detect when an @Input() value changes in Angular?](https://stackoverflow.com/a/44686085/1573267)<br>
"<b> What would be an example template syntax usage of this custom pipe?</b><br><br>```ts<br>@Pipe({ name: 'truncate' })<br>export class TruncatePipe implements PipeTransform {<br>transform(value: string, maxLength: number, showEllipsis: boolean) {<br>const newValue = maxLength ? value.substr(0, maxLength) : value;<br>return showEllipsis ? '${newValue}...' : newValue;<br>}<br>}<br>```<br><br><ul><li>`{{ 'some long text' | truncate:10 }}`</li><li>`'some long text' | truncate:10:true`</li><li>`{{ 'some long text' | truncate }}`</li><li>all of these answers[How do I call an Angular 2 pipe with multiple arguments?] (https://stackoverflow.com/questions/36816788/how-do-i-call-an-angular-2-pipe-with-multiple-arguments)<br></li></ul>",`'some long text' | truncate:10:true`
<b> Which Angular CLI command would you run to generate a UsersComponent and add it to the SharedModule (in file shared.module.ts in your application)?</b><br><ul><li>ng generate component --newModule=shared</li><li>ng generate component users --module=shared</li><li>ng generate component users --shared</li><li>ng generate component --add=shared</li></ul>,ng generate component users --module=shared
"<b> How can you rewrite this markup so the div container is not needed in the final DOM render</b><br><br>```ts<br><div *ngIf=""location""><br><h1>{{ location.name }}</h1><br><p>{{ location.description }}</p><br></div><br>```<br><br><ul><li>A```ts<br><div *ngIf=""location""><br><h1>{{ location.name }}</h1><br><p>{{ location.description }}</p><br>{{ endNgIf }}<br>```<br></li><li>B```ts<br><ng-template *ngIf=""location""><br><h1>{{ location.name }}</h1><br><p>{{ location.description }}</p><br></ng-template><br>```<br></li><li>C```ts<br><div *ngIf=""location"" [display]="" ' hidden' ""><br><h1>{{ location.name }}</h1><br><p>{{ location.description }}</p><br></div><br>```<br></li><li>D```ts<br><ng-container *ngIf=""location""><br><h1>{{ location.name }}</h1><br><p>{{ location.description }}</p><br></ng-container><br>```<br></li></ul>","D```ts<br><ng-container *ngIf=""location""><br><h1>{{ location.name }}</h1><br><p>{{ location.description }}</p><br></ng-container><br>```<br>"
"<b> Describe the usage of this code:</b><br><br>```ts<br>export interface AppSettings {<br>title: string;<br>version: number;<br>}<br>```<br><br><ul><li>This code as an error since you cannot use a TypeScript interface for the generic type on the InjectionToken.</li><li>The InjectionToken is used to create a provider token for a non-class dependency. An object lieteral can be provided as a value for the APP_SETTINGS dependency provider type that can then be injected into components, services, etc.</li><li>The InjectionToken is adding an instance of the AppSettings to the roote provider via the the InjectionToken constructor call, making it auto available to all NgModules, services, and componentts throughtout the Angular application without the need to inject it anywhere.</li><li>The InjectionToken is used to create a dynamic decorator for the AppSettings that can be sed on constructor parameters via an @AppSettings decorator.</li></ul>",The InjectionToken is used to create a dynamic decorator for the AppSettings that can be sed on constructor parameters via an @AppSettings decorator.
"<b> What Angular utilities, if any, are required to unit test a service with no constructor dependencies?</b><br><ul><li>By.css() helper method is needed</li><li>A text fixture is required to run the service for the unit test.</li><li>None. A service can be instantiated and unit tested on its own.</li><li>The TestBed class iss needed to instantiate the service.</li></ul>",The TestBed class iss needed to instantiate the service.<br><br>[Angular unit tests](https://angular.io/guide/testing-services) - recheck answers<br>
"<b> What is the difference between the CanActivate and the CanLoad route guards?</b><br><ul><li>CanActivate is used to check access. CanLoad is used to preload data for the route.</li><li>CanLoad is used at app startup to allow or deny routes to be added to the route table. CanActivate is used to manage access to routes at the time they are requested.</li><li>CanActivate and CanLoad do the exact same thing.</li><li>CanLoad prevents an entire NgModule from being delivered and loaded. CanActivate stops routing to a component in that NgModule, but that module is still loaded.</li></ul>","CanLoad is used at app startup to allow or deny routes to be added to the route table. CanActivate is used to manage access to routes at the time they are requested.<br><br>[CanActivate vs Canload](https://stackoverflow.com/questions/42026045/difference-between-angulars-canload-and-canactivate#:~:text=canActivate%20is%20used%20to%20prevent,not%20authorized%20to%20do%20so.) CanActivate prevents access on routes, CanLoad prevents lazy loading.<br>"
"<b> What is the outlet property used for in this router definition object?</b><br><br>```ts<br>{<br>path: 'document',<br>component: DocumentComponent,<br>outlet: 'document-box'<br>}<br>```<br><br><ul><li>it will locate all instancess of <document-box> in the DOM and inser a DocumentComponent element into them on route navigation.</li><li>It declares that the DocumentComponent can be used as a child to a <<document-box> element in addition ot being routed to.</li><li>It us used to target a <router-outlet> element with the name attribute matching the string value as the location for the DocumentComponent to be rendered when routed to.</li><li>It is a source of power for the router. (definitely not the answer :P)</li></ul>",It us used to target a <router-outlet> element with the name attribute matching the string value as the location for the DocumentComponent to be rendered when routed to.<br><br>[Angular-outlet](https://angular.io/api/router/RouterOutlet) - recheck answer<br>
"<b> In this template syntax, every time the items property is changed (added to, removed from, etc.), the ngFor structural directive re-runs its logic for all DOM elements in the loop. What syntax can be used to make this more performant?</b><br><br>```javascript<br><div *ngFor=""let item of items""><br>{{ item.id }} - {{ item.name }}<br></div><br>```<br><br><ul><li>`*ngFor=""let item of items; let uniqueItem""`</li><li>`*ngFor=""let item of items.distinct()""`</li><li>`*ngFor=""let item of items: let i = index""`</li><li>`*ngFor=""let item of items; trackBy: trackById""`</li></ul>","`*ngFor=""let item of items; trackBy: trackById""`<br><br>[StackOverflow - How to use `trackBy` with `ngFor`](https://stackoverflow.com/a/58025894)<br>"
"<b> What does this Angular CLI command do?</b><br><br>```bash<br>ng build --configuration=production --progress=false<br>```<br><br><ul><li>It builds the Angular application, setting the build configuration to the ""production"" target specified in the angular.json file, and logs progress output to the console.</li><li>It builds the Angular application, setting the build configuration to the ""production"" target specified in the angular.json file, and watching files for changes.</li><li>It builds the Angular application, setting the build configuration to the ""production"" target specified in the angular.json file, and disables watching files for changes.</li><li>It builds the Angular application, setting the build configuration to the ""production"" target specified in the angular.json file, and prevents progress output to the console.</li></ul>","It builds the Angular application, setting the build configuration to the ""production"" target specified in the angular.json file, and prevents progress output to the console.<br><br>[Angular documentation - `ng build`](https://angular.io/cli/build#:~:text=%2D%2D-,progress,-Log%20progress%20to)<br>"
"<b> Service classes can be registered as providers via which decorators?</b><br><ul><li>@Injectable, @NgModule, @Component, and @Directive.</li><li>@Injectable only.</li><li>@Injectable and @NgModule only.</li><li>@Service and @NgModule only.</li></ul>",@Injectable only.
"<b> What is the Input decorator used for in this component class?</b><br><br>```javascript<br>@Component({<br>selector:'app-product-name',<br>...<br>})<br>export class ProductNameComponent {<br>@Input() productName: string<br>}<br>```<br><br><ul><li>It is used simply to put a comment in front of a class field for documentation.</li><li>It provides a way to bind values to the productName field by using the component selector.</li><li>It autogenerates an `html<input type='text' id='productName'>` Dom element in the component template.<br></li><li>It provides a way to bind values to the productName instance field,just like native DOM element property bindings.</li></ul>",It provides a way to bind values to the productName field by using the component selector.<br><br>[Angular documentation - `Input()`](https://angular.io/guide/inputs-outputs)<br>
<b> Which route guard can be used to mediate navigation to a route?</b><br><ul><li>all of these answers.</li><li>CanDeactivate.</li><li>CanLoad</li><li>CanActivate.</li></ul>,all of these answers.<br><br>[Angular documentation - `Input()`](https://angular.io/guide/inputs-outputs)<br>
"<b> How can you configure the injector to use an existing object for a token instead of having it instantiate a class instance?</b><br><ul><li>Use the `useValue` provider configuration and set that equal to an existing object or an object literal.</li><li>It is not possible. Providers can be configured only with class types.</li><li>Simply add the object instance or literal to the providers array.</li><li>Make use of the `asValue` provider configuration property, setting it to true.</li></ul>",Use the `useValue` provider configuration and set that equal to an existing object or an object literal.<br><br>[Configuring dependency providers](https://angular.io/guide/dependency-injection-providers)<br>
"<b> Based on this route definition, what can be injected into UserDetailComponent constructor to get ahold of the id route parameter?</b><br><br>```ts<br>{path: 'user/:id', component: UserDetailComponent }<br>```<br><br><ul><li>ActivatedRoute</li><li>CurrentRoute</li><li>UrlPath</li><li>@Inject('id')</li></ul>",ActivatedRoute<br><br>[Common Routing Tasks](https://angular.io/guide/router#observable-parammap-and-component-reuse)<br>
"<b> With the following reactive form markup, what would you add to wire up a call to an onSubmit class method?</b><br><br>```html<br><form [formGroup]=""form""><br><input type=""text"" formControlName=""username"" /><br><button type=""submit"" [disabled]=""form. invalid"">Submit</button><br></form><br>```<br><br><ul><li>neither of these answers</li><li>Add (click)=""onSubmit()"" to the <button> element.</li><li>Add (ngSubmit )=""onSubmit ()"" to the <form> element.</li><li>both of these answers</li></ul>","Add (ngSubmit )=""onSubmit ()"" to the <form> element.<br><br>[Angular - Forms](https://angular.io/guide/forms)<br>"
"<b> What is the expected DOM code for this usage of the ngClass attribute directive when isActive is true?</b><br><br>```html<br><div [ngClass]=""{ ‘active-item': isActive }"">Item One</div><br>```<br><br><ul><li>`<div active-item>Item One</div>`</li><li>`<div class=""active-item"">Item One</div>`</li><li>`<div class=""is-active"">Item One</div>`</li><li>`<div class=""active-item isActive"">Item One</div>`</li></ul>","`<div class=""active-item"">Item One</div>`<br><br>[Angular - NgClass](https://angular.io/api/common/NgClass)<br>"
"<b> Which answer best explains the usage of ngModel in this template code?</b><br><br>```html<br><input [(ngModel)]=""user.name"" /><br>```<br><br><ul><li>It is conditionally displaying the input element if the user.name property has a value.</li><li>It is the two-way data binding syntax. The input element value property will be bound to the user.name property, and the value change event for the form element will update the user.name property value.</li><li>There is a typo in the code. It should have only the square brackets.</li><li>It is binding the value of the user.name property to the input element's val property to set its initial value.</li></ul>","It is the two-way data binding syntax. The input element value property will be bound to the user.name property, and the value change event for the form element will update the user.name property value.<br><br>[Angular - NgModel](https://angular.io/api/forms/NgModel)<br>"
<b> What method is used to wire up a FormControl to a native DOM input element in reactive forms?</b><br><ul><li>Use the string name given to the FormControl as the value for the DOM element id attribute.</li><li>Use the formControlName directive and set the value equal to the string name given to the FormControl.</li><li>Add the string name given to the FormControl to an attribute named controls on the <form> element to indicate what fields it should include.</li><li>Use the square bracket binding syntax around the value attribute on the DOM element and set that equal to an instance of the FormControl.</li></ul>,Use the formControlName directive and set the value equal to the string name given to the FormControl.<br><br>[Angular - Reactive Forms](https://angular.io/guide/reactive-forms)<br>
"<b> What other template syntax (replacing the ngClass directive) can be used to add or remove the CSS class names in this markup?</b><br><br>```html<br><span [ngClass]=""{ 'active': isActive, 'can-toggle': canToggle }""> Employed </span><br>```<br>- [ ]<br>```html<br><span class=""{{ isActive ? 'is-active' : '' }}"" class=""{{ canToggle ? 'can-toggle' : '' }}""><br>Employed<br></span><br>```<br>- [x]<br>```html<br><span [class.active]=""isActive"" [class.can-toggle]=""canToggle""> Employed </span><br>```<br>- [ ]<br>```html<br><span [styles.class.active]=""isActive"" [styles.class.can-toggle]=""canToggle""> Employed </span><br>```<br>- [ ]<br>```html<br><span [css.class.active]=""isActive"" [css.class.can-toggle]=""canToggle""> Employed </span><br>```<br><br><ul></ul>",No answer found
"<b> In this directive decorator example, what is the purpose of the multi property in the provider object literal?</b><br><br>```ts<br>@Directive({<br>selector: '[customValidator]',<br>providers: [<br>{<br>provide: NG_VALIDATORS,<br>useExisting: CustomValidatorDirective,<br>multi: true,<br>},<br>],<br>})<br>export class CustomValidatorDirective implements Validator {}<br>```<br><br><ul><li>It indicates that the CustomValidatorDirective can be used on multiple form element types.</li><li>It allows for multiple instances of the CustomValidatorDirective to be instantiated. Without multi, the CustomValidatorDirective would be a singleton for the entire app.</li><li>It allows the registration of different providers for the single NG_VALIDATORS token. In this case, it is adding the CustomValidatorDirective to the list of form validators available.</li><li>It indicates that there will be multiple classes that handle the logic implementation for the custom validator.</li></ul>","It allows the registration of different providers for the single NG_VALIDATORS token. In this case, it is adding the CustomValidatorDirective to the list of form validators available.<br><br>[StackOverflow](https://stackoverflow.com/questions/38144641/what-is-multi-provider-in-angular2)<br>"
<b> Which Angular CLI command would you use to run your unit tests in a process that reruns your test suite on file changes?</b><br><ul><li>ng test --single-run=false</li><li>ng test --watch-files</li><li>ng test --progress</li><li>ng test</li></ul>,ng test
<b> What is the most common use for the ngOnDestory lifecle hook?</b><br><ul><li>Remove dome elements from the components's view</li><li>All of theses answers</li><li>Delete any injected serviced the</li><li>Unsubscribe from obervables and detach</li></ul>,Unsubscribe from obervables and detach
