"<b> What is the purpose of the ViewChild decorator in this component class?</b><br><br>```ts<br>@Component({<br>...<br>template: '<p #bio></p>'<br>})<br>export class UserDetailsComponent {<br>@ViewChild('bio') bio;<br>}<br>```<br><br><ul><li>It provides access from within the component class to the ElementRef object for the `<p>` tag that has the bio template reference variable in the component's template view.</li><li>It indicates that the `<p>` tag be rendered as a child of the parent view that uses this component.</li><li>It makes the `<p>` tag in the template support content projection.</li><li>It makes the `<p>` tag visible in the final render. If the #bio was used in the template and the @ViewChild was not used in the class, then Angular would automatically hide the `<p>` tag that has #bio on it.</li></ul>",It provides access from within the component class to the ElementRef object for the `<p>` tag that has the bio template reference variable in the component's template view.<br><br>[DigitalOcean - viewchild-access-component](https://www.digitalocean.com/community/tutorials/angular-viewchild-access-component)<br>
<b> What method is used to wire up a FormControl to a native DOM input element in reactive forms?</b><br><ul><li>Add the string name given to the FormControl to an attribute named controls on the <form> element to indicate what fields it should include.</li><li>Use the square bracket binding syntax around the value attribute on the DOM element and set that equal to an instance of the FormControl.</li><li>Use the formControlName directive and set the value equal to the string name given to the FormControl.</li><li>Use the string name given to the FormControl as the value for the DOM element id attribute.</li></ul>,Use the formControlName directive and set the value equal to the string name given to the FormControl.<br><br>[Angular.io - Reactive Form Groups](https://angular.io/guide/reactive-forms#creating-nested-form-groups)<br>
<b> What is the difference between the `paramMap` and the `queryParamMap` on the `ActivatedRoute` class?</b><br><ul><li>The paramMap is an object literal of the parameters in a route's URL path. The queryParamMap is an Observable of those same parameters.</li><li>The paramMap is an Observable that contains the parameter values that are part of a route's URL path. The queryParamMap is a method that takes in an array of keys and is used to find specific parameters in the paramMap.</li><li>paramMap is the legacy name from Angular 3. The new name is queryParamMap.</li><li>Both are Observables containing values from the requested route's URL string. The paramMap contains the parameter values that are in the URL path and the queryParamMap contains the URL query parameters.</li></ul>,Both are Observables containing values from the requested route's URL string. The paramMap contains the parameter values that are in the URL path and the queryParamMap contains the URL query parameters.<br><br>[StackOverflow](https://stackoverflow.com/a/49617621)<br>
"<b> Based on the following usage of the async pipe, and assuming the users class field is an Observable, how many subscriptions to the users Observable are being made?</b><br><br>```html<br><h2>Names</h2><br><div *ngFor=""let user of users | async"">{{ user.name }}</div><br><h2>Ages</h2><br><div *ngFor=""let user of users | async"">{{ user.age }}</div><br><h2>Genders</h2><br><div *ngFor=""let user of users | async"">{{ user.gender }}</div><br>```<br><br><ul><li>None. The async pipe does not subscribe automatically.</li><li>None. The template syntax is not correct.</li><li>Three. There is one for each async pipe.</li><li>One. The async pipe caches Observables by type internally.</li></ul>",Three. There is one for each async pipe.<br><br>[UltimateCourses](https://ultimatecourses.com/blog/angular-ngfor-async-pipe)<br>
"<b> How can you use the HttpClient to send a POST request to an endpoint from within an addOrder function in this OrderService?</b><br><br>```ts<br>export class OrderService {<br>constructor(private httpClient: HttpClient) {}<br>addOrder(order: Order) {<br>// Missing line<br>}<br>}<br>```<br><br><ul><li>this.httpClient.url(this.orderUrl).post(order);</li><li>this.httpClient.send(this.orderUrl, order);</li><li>this.httpClient.post<Order>(this.orderUrl, order);</li><li>this.httpClient.post<Order>(this.orderUrl, order).subscribe();</li></ul>","this.httpClient.post<Order>(this.orderUrl, order).subscribe();<br><br>[Angular.io - Sending data to server](https://angular.io/guide/http#sending-data-to-a-server)<br>"
<b> What is the RouterModule.forRoot method used for?</b><br><ul><li>Registering any providers that you intend to use in routed components.</li><li>Registering route definitions at the root application level.</li><li>Indicating that Angular should cheer on your routes to be successful.</li><li>Declaring that you intend to use routing only at the root level.</li></ul>,Registering route definitions at the root application level.<br><br>[O'REILLY](https://www.oreilly.com/library/view/switching-to-angular/9781788620703/c9e90774-0e10-410b-bd20-d3e9e0b8d117.xhtml)<br>
"<b> Which DOM elements will this component metadata selector match on?</b><br><br>```ts<br>@Component({<br>selector: 'app-user-card',<br>. . .<br>})<br>```<br><br><ul><li>Any element with the attribute app-user-card, such as `<div app-user-card></div>`.</li><li>The first instance of `<app-user-card></app-user-card>`.</li><li>All instances of `<app-user-card></app-user-card>`.</li><li>All instances of `<user-card></user-card>`.</li></ul>",All instances of `<app-user-card></app-user-card>`.<br><br>[Angular.io - Component Metadata](https://angular.io/guide/architecture-components#component-metadata)<br>
"<b> What is the correct template syntax for using the built-in ngFor structural directive to render out a list of productNames?</b><br><ul><li>A```ts<br><ul><br><li [ngFor]=""let productName of productNames"">{{ productName }}</li><br></ul><br>```<br></li><li>B```ts<br><ul><br><li ngFor=""let productName of productNames"">{{ productName }}</li><br></ul><br>```<br></li><li>C```ts<br><ul><br><li *ngFor=""let productName of productNames"">{{ productName }}</li><br></ul><br>```<br></li><li>D```ts<br><ul><br><? for productName in productNames { ?><br><li>{{ productName }}</li><br><? } ?><br></ul><br>```<br></li></ul>","C```ts<br><ul><br><li *ngFor=""let productName of productNames"">{{ productName }}</li><br></ul><br>```<br><br><br>[Angular.io- Structural Directives](https://angular.io/guide/built-in-directives#listing-items-with-ngfor)<br>"
<b> What are the two component decorator metadata properties used to set up CSS styles for a component?</b><br><ul><li>viewEncapsulation and viewEncapsulationFiles.</li><li>There is only one and it is the property named css.</li><li>css and cssUrl.</li><li>styles and styleUrls.</li></ul>,styles and styleUrls.<br><br>[Angular.io - Component Styles](https://angular.io/guide/component-styles)<br>
"<b> With the following component class, what template syntax would you use in the template to display the value of the title class field?</b><br><br>```ts<br>@Component({<br>selector: 'app-title-card',<br>template: '',<br>})<br>class TitleCardComponent {<br>title = 'User Data';<br>}<br>```<br><br><ul><li>`{{ 'title' }}`</li><li>`{{ title }}`</li><li>`[title]`</li><li>A class field cannot be displayed in a template via the template syntax.</li></ul>",`{{ title }}`<br><br>[Angular.io - String Interpolation or Text Interpolation](https://angular.io/guide/interpolation)<br>
"<b> What is the purpose of the valueChanges method on a FormControl?</b><br><ul><li>It is used to configure what values are allowed for the control.</li><li>It is used to change the value of a control to a new value. You would call that method and pass in the new value for the form field. It even supports passing in an array of values that can be set over time.</li><li>It returns a Boolean based on if the value of the control is different from the value with which it was initialized.</li><li>It is an observable that emits every time the value of the control changes, so you can react to new values and make logic decisions at that time.</li></ul>","It is an observable that emits every time the value of the control changes, so you can react to new values and make logic decisions at that time.<br><br>[Angular.io - Displaying a from control value](https://angular.io/guide/reactive-forms#displaying-a-form-control-value)<br>"
<b> What directive is used to link an `<a>` tag to routing?</b><br><ul><li>routeTo</li><li>routerLink</li><li>routePath</li><li>appLink</li></ul>,routerLink<br><br>[Angular.io - RouterLink](https://angular.io/api/router/RouterLink#description)<br>
"<b> What is the Output decorator used for in this component class?</b><br><br>```ts<br>@Component({<br>selector: 'app-shopping-cart',<br>. . .<br>})<br>export class ShoppingCartComponent {<br>@Output() itemTotalChanged = new EventEmitter();<br>}<br>```<br><br><ul><li>It makes the `itemTotalChanged` class field public.</li><li>It provides a way to bind values to the `itemTotalChanged` class field, like so: `<app-shopping-cart [itemTotalChanged]=""newTotal""></app-shopping-cart>`.</li><li>It provides a way to bind events to the `itemTotalChanged` class field, like so: `<app-shopping-cart (itemTotalChanged)=""logNewTotal($event)""></app-shopping-cart>`.</li><li>It is simply a way to put a comment in front of a class field for documentation.</li></ul>","It provides a way to bind events to the `itemTotalChanged` class field, like so: `<app-shopping-cart (itemTotalChanged)=""logNewTotal($event)""></app-shopping-cart>`.<br><br>[Angular.io - Sending data to parent component](https://angular.io/guide/inputs-outputs#sending-data-to-a-parent-component)<br>"
"<b> What is the difference between these two markup examples for conditionally handling display?</b><br><br>```html<br><div *ngIf=""isVisible"">Active</div><br><div [hidden]=""!isVisible"">Active</div><br>```<br><br><ul><li>The `ngIf` is shorthand for the other example. When Angular processes that directive, it writes a div element to the DOM with the hidden property.</li><li>They are fundamentally the same.</li><li>The `ngIf` directive does not render the div in the DOM if the expression is false. The `hidden` property usage hides the div content in the browser viewport, but the div is still in the DOM.</li><li>The `ngIf` is valid, but the use of the `hidden` property is wrong and will throw an error.</li></ul>","The `ngIf` directive does not render the div in the DOM if the expression is false. The `hidden` property usage hides the div content in the browser viewport, but the div is still in the DOM.<br><br>[StackOverflow](https://stackoverflow.com/a/39778145)<br>"
"<b> How can you disable the submit button when the form has errors in this template-driven forms example?</b><br><br>```html<br><form #userForm=""ngForm""><br><input type=""text"" ngModel name=""firstName"" required /><br><input type=""text"" ngModel name=""lastName"" required /><br><button (click)=""submit(userForm.value)"">Save</button><br></form><br>```<br><br><ul><li>A```html<br><button (click)=""submit(userForm.value)"" disable=""userForm.invalid"">Save</button><br>```<br></li><li>B```html<br><button (click)=""submit(userForm.value)"" [disabled]=""userForm.invalid"">Save</button><br>```<br></li><li>C```html<br><button (click)=""submit(userForm.value)"" [ngForm.disabled]=""userForm.valid"">Save</button><br>```<br></li><li>D```html<br><button (click)=""submit(userForm.value)"" *ngIf=""userForm.valid"">Save</button><br>```<br></li></ul>","B```html<br><button (click)=""submit(userForm.value)"" [disabled]=""userForm.invalid"">Save</button><br>```<br><br><br>[Angular.io - Submit the form with ngSubmit](https://angular.io/guide/forms#submit-the-form-with-ngsubmit)<br>"
<b> You want to see what files would be generated by creating a new contact-card component. Which command would you use?</b><br><ul><li>ng generate component contact-card --dry-run</li><li>ng generate component contact-card --no-files</li><li>ng generate component component --dry</li><li>ng generate component --exclude</li></ul>,ng generate component contact-card --dry-run<br><br>[Angular.io - ng generate options](https://angular.io/cli/generate#options)<br>
"<b> Based on the following component, what template syntax would you use to bind the TitleCardComponent's titleText field to the h</b><br><br>```ts<br>@Component({<br>selector: 'app-title-card',<br>template: '<h1 title=""User Data""> {{titleText}}</h1>',<br>})<br>export class TitleCardComponent {<br>titleText = 'User Data';<br>}<br>```<br><br><ul><li>`<h1 data-title=""titleText"">{{ titleText }}</h1>`</li><li>`<h1 title=""titleText"">{{ titleText }}</h1>`</li><li>`<h1 [title]=""titleText"">{{ titleText }}</h1>`</li><li>`<h1 titleText>{{ titleText }}</h1>`</li></ul>","`<h1 [title]=""titleText"">{{ titleText }}</h1>`<br><br>[Angular.io - String Interpolation](https://angular.io/guide/interpolation)<br>"
"<b> What are Angular lifecycle hooks?</b><br><ul><li>loggers for tracking the health of an Angular app</li><li>providers that can be used to track the instances of components</li><li>built-in pipes that can be used in templates for DOM events</li><li>reserved named methods for components and directives that Angular will call during set times in its execution, and can be used to tap into those lifecycle moments</li></ul>","reserved named methods for components and directives that Angular will call during set times in its execution, and can be used to tap into those lifecycle moments<br><br>[Angular.io - Lifecycle hooks](https://angular.io/guide/lifecycle-hooks)<br>"
"<b> Pick the best description for this template syntax code:</b><br><br>```html<br><span>Boss: {{job?.bossName}} </span><br>```<br><br><ul><li>The ? is shorthand for the async pipe. The job value must be an Observable.</li><li>It is using the safe navigation operator (?) on the job field. If the job field is undefined, the access to the bossName will be ignored and no error will occur.</li><li>There is an error in the template syntax. The ? is not valid here.</li><li>It is diplaying the job value if it has one; otherwise it is displaying the bossName.</li></ul>","It is using the safe navigation operator (?) on the job field. If the job field is undefined, the access to the bossName will be ignored and no error will occur.<br><br>[StackOverflow](https://stackoverflow.com/a/60182134)<br>"
"<b> How would you configure a route definition for a UserDetailComponent that supports the URL path user/</b><br><ul><li>`{ path: 'user/:id', component: UserDetailComponent }`</li><li>`{ url: 'user/:id', routedComponent: UserDetailComponent }`</li><li>`{ routedPath: 'user/:id', component: UserDetailComponent }`</li><li>`{ destination: new UserDetailComponent(), route: 'user/:id' }`</li></ul>","`{ path: 'user/:id', component: UserDetailComponent }`<br><br>[CodeCraft - Parameterised Routes](https://codecraft.tv/courses/angular/routing/parameterised-routes/#_configuration)<br>"
"<b> What are the HostListener decorators and the HostBinding decorator doing in this directive?</b><br><br>```ts<br>@Directive({<br>selector: '[appCallout]',<br>})<br>export class CalloutDirective {<br>@HostBinding('style.font-weight') fontWeight = 'normal';<br>@HostListener('mouseenter')<br>onMouseEnter() {<br>this.fontWeight = 'bold';<br>}<br>@HostListener('mouseleave')<br>onMouseLeave() {<br>this.fontWeight = 'normal';<br>}<br>}<br>```<br><br><ul><li>They are setting the CalloutDirective.fontWeight field based on whether or not the mouse is over the DOM element. The HostListener then sets the font-weight CSS property to the fontWeight value.</li><li>They are setting up the directive to check the DOM element that it is on. If it has event bindings added for mouse enter and leave it will use this code. Otherwise nothing will happen.</li><li>This is an incorrect use of HostListener and HostBinding. The HostListener and HostBinding decorators do not do anything on directives; they work only when used on components.</li><li>If the DOM element that this directive is placed on has the CSS property font-weight set on it, the mouseenter and mouseleave events will get raised.</li></ul>",They are setting the CalloutDirective.fontWeight field based on whether or not the mouse is over the DOM element. The HostListener then sets the font-weight CSS property to the fontWeight value.<br><br>[DigitalOcean](https://www.digitalocean.com/community/tutorials/angular-hostbinding-hostlistener)<br>
"<b> What Angular template syntax can you use on this template-driven form field to access the field value and check for validation within the template markup?</b><br><br>```html<br><input type=""text"" ngModel name=""firstName"" required minlength=""4"" /><br><span *ngIf="""">Invalid field data</span><br>```<br><br><ul><li>You can make use of a template reference variable and the exportAs feature that the ngModel directive has.</li><li>You can use the ngModel directive in combination with the input field name.</li><li>You can use a template reference variable for the HTML input element and then check the valid property off of that.</li><li>It is not possible to get access to the field value with template-driven forms. You must use reactive forms for that.1. [Angular.io -Show and hide validation error ](https://angular.io/guide/forms#show-and-hide-validation-error-messages)<br>2. [Medium](https://medium.com/@agoiabeladeyemi/template-driven-forms-in-angular-4a3a5ad960de)<br></li></ul>",You can make use of a template reference variable and the exportAs feature that the ngModel directive has.
"<b> What is the value type that will be stored in the headerText template reference variable in this markup?</b><br><br>```html<br><h1 #headerText>User List</h1><br>```<br><br><ul><li>an Angular ElementRef, a wrapper around a native element</li><li>the inner text of the `<h1>` element</li><li>a header component class</li><li>the native DOM element type of HTMLHeadingElement</li></ul>","an Angular ElementRef, a wrapper around a native element<br><br>[Pluralsight - Template reference variable](https://www.pluralsight.com/guides/how-to-use-template-reference-variables-in-angular)<br>"
"<b> What is the difference, if any, of the resulting code logic based on these two provider configurations?</b><br><br>```ts<br>[{ provide: FormattedLogger, useClass: Logger }][{ provide: FormattedLogger, useExisting: Logger }];<br>```<br><br><ul><li>They are the same. Both will result in a new instance of Logger that is bound to the FormattedLogger token.</li><li>The useClass syntax tells the injector to make a new instance of Logger and bind that instance to the FormattedLogger token. The useExisting syntax refers to an already existing object instance declared as Logger.</li><li>Both of them are wrong. A strong type connot be used for useClass or useExisting.</li><li>They are the same. Both will result in the FormattedLogger token being an alias for the instance of Logger.1. [Angular.io - Dependency Providers](https://angular.io/guide/dependency-injection-providers#defining-providers)<br>2. [TektutorialHub](https://www.tektutorialshub.com/angular/angular-providers/)<br></li></ul>",The useClass syntax tells the injector to make a new instance of Logger and bind that instance to the FormattedLogger token. The useExisting syntax refers to an already existing object instance declared as Logger.
"<b> What is the purpose of the data property (seen in the example below) in a route configuration?</b><br><br>```ts<br>{<br>path: 'customers',<br>component: CustomerListComponent,<br>data: { accountSection: true }<br>}<br>```<br><br><ul><li>a key/value mapping for setting @Input values on the routed component instance</li><li>a way to include static, read-only data associated with the route that can be retrieved from the ActivatedRoute</li><li>a property on the route that can be used to load dynamic data for the route</li><li>an object that will get auto-injected into the routed component's constructor.1. [TektutorialsHub](https://www.tektutorialshub.com/angular/angular-pass-data-to-route/#:~:text=Angular%20allows%20us%20to%20pass,of%20the%20history%20state%20object)<br>2. [StackOverflow](https://stackoverflow.com/a/36835156)<br></li></ul>","a way to include static, read-only data associated with the route that can be retrieved from the ActivatedRoute"
"<b> How does the built-in `ngIf` structural directive change the rendered DOM based on this template syntax?</b><br><br>```ts<br>@Component({<br>selector: 'app-product',<br>template: '<div *ngIf=""product"">{{ product.name }}</div>',<br>})<br>export class ProductComponent {<br>@Input() product;<br>}<br>```<br><br><ul><li>The `<div>` acts as a placeholder. If the product class field is ""truthy,"" the `<div>` will get replaced by just the `product.name` value; if not, then nothing will get rendered.</li><li>The `<div>` will always be rendered, and if the product field is ""truthy,"" the `<div>` element will contain the `product.name` value; otherwise it will render the `<div>` element with no value in it.</li><li>It produces an error, since ngIf is not a built-in structural directive.</li><li>If the product class field is ""truthy,"" then the rendered DOM will include the `<div>` with the value of the `product.name` field. If it is not ""truthy,' the rendered DOM will not contain the `<div>` element.</li></ul>","If the product class field is ""truthy,"" then the rendered DOM will include the `<div>` with the value of the `product.name` field. If it is not ""truthy,' the rendered DOM will not contain the `<div>` element.<br><br>[Reference (angular.io)](https://angular.io/api/common/NgIf)<br>"
"<b> What does this code accomplish?</b><br><br>```ts<br>@NgModule({<br>declarations: [AppComponent],<br>imports: [BrowserModule],<br>bootstrap: [AppComponent],<br>})<br>export class AppModule {}<br>platformBrowserDynamic().bootstrapModule(AppModule);<br>```<br><br><ul><li>It executes a unit test for an NgModule.</li><li>It provides a way to code the document structure of an Angular application. The @NgModule is a form of inline code commenting that gets ignored by the TypeScript compiler but will show up with special formatting in code editor applications.</li><li>It declares an Angular module named AppModule and makes it available for lazy loading throughout the application.</li><li>It declares an Angular module named AppModule that contains a bootstrapped component named AppComponent. Then it registers that module with Angular, so the app can start up.</li></ul>","It declares an Angular module named AppModule that contains a bootstrapped component named AppComponent. Then it registers that module with Angular, so the app can start up.<br><br>[Angular.io - The basic NgModule](https://angular.io/guide/ngmodules#the-basic-ngmodule)<br>"
"<b> Which choice best describes what the _resolve_ property does in this route configuration?</b><br><br>```ts<br>{<br>path: ':id',<br>component: UserComponent,<br>resolve: {<br>user: UserResolverService<br>}<br>}<br>```<br><br><ul><li>Prior to loading the _UserComponent_, the router will subscribe to the _Observable_ returned by a _resolve_ method in the _UserResolverService_. This technique can be used to get preloaded data for a _route_.</li><li>After the _route_ is done resolving, and the component is loaded and rendered, the _UserResolverService_ will have a method named _user_ run that will clean up any open data connections.</li><li>There is an error. The correct property name is _onResolve_.</li><li>The _UserComponent_ will have a parameter in its constructor for _user_, and the _router_ will handle injecting in a value for that from a call to a _user_ method in the _UserResolverService_.</li></ul>","Prior to loading the _UserComponent_, the router will subscribe to the _Observable_ returned by a _resolve_ method in the _UserResolverService_. This technique can be used to get preloaded data for a _route_.<br><br>[angular.io](https://angular.io/api/router/Resolve)<br>"
"<b> What is the purpose of the ContentChildren decorator in this component class?</b><br><br>```ts<br>@Component({<br>. . .<br>template: '<ng-content></ng-content›'<br>})<br>export class TabsListComponent {<br>@ContentChildren(TabComponent) tabs;<br>}<br>```<br><br><ul><li>If any _TabsComponent_ elements are added to the _TabsListComponent_ template, they will get put into the <ng-content> element at runtime.</li><li>It creates _TabComponent_ components in the _TabsListComponent_ template when a _TabsListComponent_ is instantiated.</li><li>It provides access from within the component class to any _TabComponent_ components that were content projected into the <ng-content> for this component.</li><li>It restricts the allowed elements that can be put into a _TabsListComponent_ element to allow only _TabComponent_ elements.</li></ul>",It provides access from within the component class to any _TabComponent_ components that were content projected into the <ng-content> for this component.<br><br>[betterprogramming.pub](https://betterprogramming.pub/understanding-contentchildren-with-an-example-e76ce78968db)<br>
"<b> In order for Angular to process components in an application, where do the component types need to be registered?</b><br><ul><li>within a script tag in the index.html file</li><li>in an NgModule decorator metadata tag named _components_</li><li>No registration is needed simply include the component files in an app directory.</li><li>in an NgModule decorator metadata property named _declarations_</li></ul>",in an NgModule decorator metadata property named _declarations_<br><br>[angular.io](https://angular.io/guide/ngmodule-api#ngmodule-metadata)<br>
