"<b> You have an element with a series of code (not CSS) animations applied to it that could be triggered by code you control, or other code elsewhere (such as plugins). How can you fire some code when all those animations have completed?</b><br><ul><li>A```js<br>$('#element').on('animationend', function () {<br>console.log('Finally, everything is done!');<br>});<br>```<br></li><li>B```js<br>$('#element')<br>.on('promise')<br>.then(function () {<br>console.log('Finally, everything is done!');<br>});<br>```<br></li><li>C```js<br>$('#element')<br>.promise()<br>.catch(function () {<br>console.log('Finally, everything is done!');<br>});<br>```<br></li><li>D```js<br>$('#element')<br>.promise()<br>.then(function () {<br>console.log('Finally, everything is done!');<br>});<br>```<br>1. [Source: HTMLElement: animationend event | MDN ](https://developer.mozilla.org/en-US/docs/Web/API/HTMLElement/animationend_event)<br>2. [Example: Stackoverflow](https://stackoverflow.com/questions/49580666/check-if-an-css-animation-is-completed-with-jquery-or-js)<br></li></ul>",No answer found
"<b> HTML</b><br><br>```html<br><div class=""quotes""><br><blockquote data-favorite=""false"">A quote</blockquote><br><blockquote data-favorite=""false"">A favorite quote</blockquote><br><blockquote data-favorite=""false"">A quote</blockquote><br><blockquote data-favorite=""false"">A quote</blockquote><br></div><br>```<br><br><ul><li>`$('blockquote'):second().attr('favorite', true);`</li><li>`$('blockquote:nth-child(2)').data('favorite', true);`</li><li>`$('blockquote').second().data('favorite', true);`</li><li>`$('blockquote:nth-child(2)').attr('favorite', true);`1. [Source: .data() | jQuery API Documentation](https://api.jquery.com/data/)<br>2. [Source: :nth-child() | MDN Docs](https://developer.mozilla.org/en-US/docs/Web/CSS/:nth-child)<br></li></ul>","`$('blockquote:nth-child(2)').data('favorite', true);`"
"<b> jQuery can create event handlers that execute exactly once. How is this done?</b><br><ul><li>`$('button').click(function() { console.log('this will only happen once'); }, false);`</li><li>`$('button').on('click', function() { console.log('this will only happen once'); }).off('click');`</li><li>`$('button').once('click', function() { console.log('this will only happen once'); });`</li><li>`$('button').one('click', function() { console.log('this will only happen once'); });`</li></ul>","`$('button').one('click', function() { console.log('this will only happen once'); });`<br><br>[Source: .one() | jQuery API Documentation](https://api.jquery.com/one/)<br>"
"<b> You want to implement the behavior of an effect like `slideDown()` manually using `animate()`. What is one critical point you need to remember?</b><br><ul><li>`slideDown()` requires animating the background color; doing so with `animate()` requires the jQuery Color plugin.</li><li>`slideDown()` includes toggling visibility automatically. `animate()` does not automatically set any properties.</li><li>`slideDown()` requires the element to have a height set in pixels. `animate()` does not.</li><li>Effects created with `animate()` must be run over at least 100 milliseconds, where `slideDown()` can run as quickly as 50ms.</li></ul>",`slideDown()` includes toggling visibility automatically. `animate()` does not automatically set any properties.<br><br>[Source: .slideDown() | jQuery API Documentation](https://api.jquery.com/slidedown/)<br>[Source: .animate() | jQuery API Documentation](https://api.jquery.com/animate/)\<br>
"<b> What is the main difference between the `contents()` and `children()` functions?</b><br><ul><li>They both return the content of selected nodes, but `children()` also includes text and comment nodes.</li><li>The `contents()` function only includes text nodes of the selected elements.</li><li>The `children()` function only includes text nodes of the selected elements.</li><li>They both return the content of selected nodes, but `contents()` also includes text and comment nodes.1. [Source: .children() | jQuery API Documentation](https://api.jquery.com/children/)<br>2. [Source: .contents() | jQuery API Documentation](https://api.jquery.com/contents/)<br></li></ul>","They both return the content of selected nodes, but `contents()` also includes text and comment nodes.1. [Source: .children() | jQuery API Documentation](https://api.jquery.com/children/)<br>2. [Source: .contents() | jQuery API Documentation](https://api.jquery.com/contents/)<br>"
"<b> If your JavaScript project involves a lot of DOM manipulation, but no AJAX or animation, which version of jQuery should you use?</b><br><ul><li>jQuery 3 compressed</li><li>jQuery 3 slim</li><li>jQuery 2</li><li>None of these - jQuery requires AJAX</li></ul>",None of these - jQuery requires AJAX
"<b> The `.ready()` function is one of the most basic parts of jQuery, but jQuery also provides a mechanism for executing code when both one or more Promises have resolved and the DOM is ready. Which code snippet accomplishes this?</b><br><ul><li>A```js<br>$(function({<br>getData : $.get('http://httpbin.org/get'),<br>delayedData : $.get('http://httpbin.org/delay/3')<br>})  {<br>//DOM is ready, getData and delayedData are available<br>});<br>```<br></li><li>B```js<br>$($.get('http://httpbin.org/get'), $.get('http://httpbin.org/delay/3')).then(function (<br>getData,<br>delayedData,<br>) {<br>//DOM is ready, getData and delayedData are available<br>});<br>```<br></li><li>C```js<br>$.when($.get('http://httpbin.org/get'), $.get('http://httpbin.org/delay/3')).then(function (<br>getData,<br>delayedData,<br>) {<br>//DOM is ready, getData and delayedData are available<br>});<br>```<br></li><li>D```js<br>$.ready($.get('http://httpbin.org/get'), $.get('http://httpbin.org/delay/3')).then(function (<br>getData,<br>delayedData,<br>) {<br>//DOM is ready, getData and delayedData are available<br>});<br>```<br></li></ul>","D```js<br>$.ready($.get('http://httpbin.org/get'), $.get('http://httpbin.org/delay/3')).then(function (<br>getData,<br>delayedData,<br>) {<br>//DOM is ready, getData and delayedData are available<br>});<br>```<br>"
"<b> You want to take an element and any event handlers that go with it out of the DOM to do some work—without the changes affecting the rest of the page—and then move it somewhere else in the DOM, like right after the opening tag. What should go on the first line of this code snippet?</b><br><br>```js<br>// what goes here?<br>// ... do some other hidden work on $example<br>$example.prependTo(document.body);<br>```<br><br><ul><li>`var $example = $('#example').remove();`</li><li>`var $example = $('#example').clone();`</li><li>`var $example = $('#example').detach();`</li><li>`var $example = $('#example').addBack().empty();`https://api.jquery.com/detach/<br></li></ul>",`var $example = $('#example').detach();`
"<b> Review the HTML below. You want to select the first item in the list and fade it out, then select the subsequent items up to (but not including) the active item, and fade them out halfway. How can you set up a single chain to do this?</b><br><br>```html<br><ul class=""items""><br><li>Item 1</li><br><li>Item 2</li><br><li>Item 3</li><br><li class=""active"">Item 4</li><br><li>Item 5</li><br><li>Item 6</li><br></ul><br>```<br><br><ul><li>A```js<br>$('.items > li').first().fadeOut().nextUntil('.active').fadeTo('fast', 0.5);<br>```<br></li><li>B```js<br>$('.items').children(':first-child').fadeOut().filter('.active').fadeTo('fast', 0.5);<br>```<br></li><li>C```js<br>$('.items > li').first().fadeOut().nextAll('.active').fadeOut(50);<br>```<br></li><li>D```js<br>$('.items').find('li:first-child').fadeOut().next('.active').fadeTo('fast', 0.5);<br>```<br>1. https://api.jquery.com/fadeTo/<br>2. https://api.jquery.com/fadeOut/<br>3. https://api.jquery.com/nextUntil/<br></li></ul>","A```js<br>$('.items > li').first().fadeOut().nextUntil('.active').fadeTo('fast', 0.5);<br>```<br>"
"<b> What is a particular performance concern when dealing with event handlers, and how can you cope with it?</b><br><ul><li>Finding which element an event occurred on is expensive. Assign most events to document.body and use .is() to act on the element of interest.</li><li>Some events, such as mousemove and scroll, happen a lot on a typical page. Debounce or throttle their handlers to make sure the handlers are not called more than you actually need.</li><li>Listening for an event that does not exist can create serious memory leaks. Be careful to spell event names correctly to avoid consuming too much memory.</li><li>DOM elements with an ID wil fire events more efficiently than with classes. Always use IDs instead of classes where possible.</li></ul>","Some events, such as mousemove and scroll, happen a lot on a typical page. Debounce or throttle their handlers to make sure the handlers are not called more than you actually need."
"<b> What is the purpose of the jQuery.fx.off global property?</b><br><ul><li>It turns off animations that are used to provide motion effect, but appearance effects remain enabled.</li><li>It causes animation effects that are triggered via functions to instead be executed using CSS.</li><li>It globally disables all animations. When animations are run, all animation methods will immediately set elements to their final state when called, rather than displaying an effect.</li><li>It globally disables animations that are triggered by CSS class changes.</li></ul>","It globally disables all animations. When animations are run, all animation methods will immediately set elements to their final state when called, rather than displaying an effect.<br><br>[Source: jQuery.fx.off Property](https://www.w3schools.com/jquery/prop_jquery_fx_off.asp)<br>"
